판례일련번호,구분,문장번호,내용
304182,판례내용,86,그러므로 피고인 A1로서는울산공장의 부지대금이 포함되어야 한다고 구두로만 주장할 것이 아니라 해당 지분의가격 평가에 결정적으로 영향을 미치는 중요 자산에 대한 적법한 최근 평가자료를 제시하는 등 상대방의 부당한 주장에 회사를 위하여 적극적으로 대처하여야 함에도 이에이르지 아니한 채 YY의 매출이 떨어져서 처분을 할 수 밖에 없다는 성급한 판단으로상대방의 요구에 쉽게 응하면서 자신의 개인적인 요구를 덧붙인 것으로 볼 수밖에 없다.
304182,판례내용,87,"③ 투자지분의 매각 협상에 있어서 상대방 측의 대리인이자 YY의 대표이사 자격으로 나선 인사는 XX의 상무로 근무하는 피고인 A2의 형인 위 F로서, 그는 XX에서 근무한 경력까지 가지고 있어, 위 투자지분의 처분과 관련하여, 피고인 A1의 비정상적인다른 요구를 들어주는 등의 모종의 이면약정이 가능하다는 정황을 의심케 한다."
304182,판례내용,88,"특히,위 협상에 있어서 피고인 A1이 먼저 그 회사의 이사직을 달라고 제의하였다는 점에서더욱 그렇다(증거기록 1503면)."
304182,판례내용,89,④ 지분을 매입하는 SS는 가계약서의 위 문언에 비추어 피고인 A1에게 지불하는 30만 불을 지분의 매각과 무관한 별개의 계약이 아니라하나의 매입계약으로 인식하고 있음이 분명하다.
304182,판례내용,90,"투자지분의 인수대금 285억 원과 피고인 A1의 급여 30만 불의 합계금을 최종 인수대금으로 하고, 그 이상의 요구를 하지못한다고 못박은 점을 보더라도 그렇다."
304182,판례내용,91,"⑤ 위 약정 이후 피고인 A1은 그 회사에 대하여 자문에 응하거나 이사로서 경영에 전혀 참여한 바 없음은 같은 피고인 또한 자인하고 있다(증거기록 1754면, 1755면)."
304182,판례내용,92,⑥ 투자지분 매각 이후 대가지불을 이유로 한 피고인 A1에 대한 경업금지의무와 비밀유지의무는 상법 등 관련 분야와 업계의 당연한책무를 주의적으로 규정한데 불과하고 이에 대하여 두 회사가 주장하는 바와 같이 관련 지분을 보유한 바 있는 매각 회사의 대표이사에게 일정기간 비상근이사로 임명한다음 상당한 정도의 보수를 지급하는 것은 지극히 이례적인 것으로 이를 납득할 수 없다.
304182,판례내용,93,"⑦ 이상과 같은 제반 사정에 비추어 볼 때, 피고인 A1은, 상대방과의 동의하에, 자신과 친분관계가 있는 위 F에게, 위 매각과 관련하여 자신이 매각 관련 회사의 자문에응하거나 비상근이사로 근무한다는 구실을 내세워 전혀 근거 없는 대가를 요구하는 한편, 법인이 보유하는 매각지분을 현실가격이 반영되지 아니한 가격으로 처분함으로써결과적으로 XX에 적정가격과의 차액만큼의 손해를 입게 한 것이라고 아니할 수 없다."
304182,판례내용,94,이는 곧 회사에 귀속되어야 할 추가 이익을 포기하는 대신 그 대가로 자신이 공소사실기재의 금품을 제공받기로 약정한 다음 그 중 일부를 수령한 것에 다를 바 없다.
304182,판례내용,95,"피고인 A1은 자신이 XX의 주식 대부분을 소유함으로써 그 회사의 1인 주주로서 사실상개인회사와 다름없다고 주장하면서, 그런 뜻에서 앞서 본 바와 같이 회사자금의 임의사용은 물론 이와 같은 자산의 처분에 있어서 아무런 문제없는 것처럼 인식하고 있으나, 법인과 대표이사인 개인은 주주와 채권자와의 이해관계 및 세제상의 부담 등 법률상 그 규제의 강도와 내용을 전혀 달리하는 별개의 인격체로서, 법인이 보유하는 자산의 사용과 처분은 법률과 일반적으로 인정되는 회계준칙에 따른, 정상적이고 납득할수 있는 방법으로 행하여져야 한다."
304182,판례내용,96,"그럼에도 피고인 A1은 법인체의 인격에 관한 법리와 경영준칙을 인식하지 못한 채 자신의 개인적인 이익의 실현을 위하여 사회상규와신의성실에 반하는 방법으로 회사자산을 위와 같이 부적정하게 처분함과 동시에 그에대한 대가를 취득한 이상, 같은 피고인이 그 회사의 대표이사 겸 ‘1인 주주’ 또는 ‘지배 주주’라고 하더라도 결국 형법에 정한 배임수재의 죄책을 면할 수 없고, 따라서 그부분에 관한 피고인 A1의 이 사건 공소사실은 그 증명이 있다고 할 것이다."
304182,판례내용,97,이와 다른견해의 같은 피고인 및 변호인의 주장은 이를 받아들이지 아니 한다.
304182,판례내용,98,"1.이 사건 범행은, 피고인 A1은 대표이사로, 피고인 A2는 상무이사로 각 근무하면서공모하여 회사의 자금을 임의로 인출하여 이를 피고인 A1의 개인적인 용도로 사용하는 한편, 피고인 A1은 회사의 투자지분을 매각함에 있어 개인적인 이득을 취할 목적으로 저가로 처분하여 정상가와의 차액만큼 회사에 손해를 끼치고 이에 대하여 1억4,000만원 상당의 대가를 수령하였다는 것이다."
304182,판례내용,99,"피고인 A1은 자신이 대표이사로 있는XX을 자신의 개인회사로 생각한 나머지 회사의 자금을 수시로 인출하여 이를 그림구입대금, 여행경비지급, 차량구입, 골프회원권 구입, 개인 종합소득세 납부, 국회의원 후원금 지급, 집수리 대금지불 등 전혀 회사의 업무와 무관한 부분에 임의로 전용하여회사의 재무건전성을 해하고, 상법상 ‘주식회사’ 제도의 제도적 장점을 자신의 개인적인 이득 실현을 위한 도구로 이용하였으며, 피고인 A2 역시 이러한 범죄행위에 적극가담하여 이를 가능케 하였다는 점에서, 그뿐만 아니라 회사 자산을 정상가보다 저가로 처분하고, 그 대가를 수령하는 방법으로 대표이사로서 그 임무를 위배하였으니 그죄가 결코 가벼운 것이 아닐뿐더러 비난가능성 또한 작은 것이 아니다."
304182,판례내용,100,피고인들은 이에 상응하는 처벌을 받음이 마땅하다.
304182,판례내용,101,"2.다만, 피고인들은 과거 형사처벌을 받은 전력이 전혀 없고, 횡령금액 전액을 회사에반환하여 피해를 보전하였으며, 피고인 A1은 벨기에 명예영사로 임명되는 등 다양한사회봉사활동으로 사회발전에 기여해 온 것으로 보이고, 피고인 A2는 대표이사인 피고인 A1의 요청을 거절하기 어려운 위치에 있었던 것으로 생각된다."
304182,판례내용,102,이러한 정상을 그형을 정함에 있어 특별히 참작하기로 한다.
304182,판례내용,103,"3.그밖에 피고인의 연령, 성행, 가정환경, 범행의 동기, 수단 및 결과, 범행 후의 정황등 여러 양형조건을 종합적으로 고려하여 법률이 정한 그 형기의 범위 내에서 피고인의 이 사건 범행에 대한 형을 주문과 같이 정하여 선고한다."
304182,판례내용,104,재판장 판사 고○ _________________________
304182,판례내용,105,판사 김○ _________________________
304182,판례내용,106,판사 허○ _________________________
