판례일련번호,구분,문장번호,내용
322810,판례내용,77,"2)피고인 B이 2021.10.초순경 C에게 요구한 D시청 일부 직책에 대한 인사권의 경우, 자신을 그 제공의 상대방으로 특정하였는바, 피고인 A은 수사기관에서부터 이 법정에 이르기까지 일관되게 피고인 B과 D시청 국·과장 자리 등 인사권에 대하여 사전에 논의한바 없다고 진술하고 있고, 피고인 B의 주장에 따르더라도 피고인 A을 선거캠프에 복귀시키기 위해 제안한 것으로 피고인 A과 따로 조율된 것이 아니라는 것이므로, 피고인 B이 위 요구과정에서 내심으로는 C이 이를 수락할 경우 피고인 A과 상의하거나 일부를 피고인 A의 몫으로 할 것을 계획하고 있었다고 하더라도, 피고인 B은 일단 자신에게 그 인사권 전체를 제공하라고 요구하였다고 보아야 한다."
322810,판례내용,78,"3)한편 공직선거법 제230조 제3항은 같은 법 제230조 제1항이 규정한 범죄를 지시, 권유, 요구, 알선하는 행위를 독립한 범죄로 하여 가중처벌함으로써 동종 범죄의 조장을 방지하기 위한 규정으로, 그 주체에는 아무런 제한이 없으므로 반드시 금품 등 이익에 따른 혜택을 직접 받는 자로 한정할 것은 아니고, 다른 제3자에 대한 매수 및 이해유도행위를 지시, 권유, 요구, 알선하는 행위도 여기에 해당한다."
322810,판례내용,79,"공직선거법 제230조 제1항 제1호(선거사무장, 선거연락소장 등), 제2호(학교, 공공기관 등의 기관·단체·시설), 제3호(야유회·동창회 등 선거구민 모임)에서는 그 상대방을 한정적으로 열거하고 있으므로, 여기에 속하는 개인 또는 단체 등이 이익 제공을 지시 내지 요구하는 경우에만 공직선거법 제230조 제3항이 적용된다고 볼 수는 없다."
322810,판례내용,80,따라서 피고인들의 주장대로 각 이익제공 요구행위에 있어 피고인들이 그 귀속주체가 아니더라도 매수 및 이해유도 요구죄의 성립에 영향이 없다.
322810,판례내용,81,4)피고인들이 그 주장을 뒷받침하기 위하여 인용하는 대법원 2002.2.21.
322810,판례내용,82,"선고 2001도2819 전원합의체 판결은 후보자의 배우자가 선거사무원에게 유권자 제공용으로 금전을 교부한 행위가 공직선거법 제112조 제1항 소정의 ‘기부행위’에 해당하는지가 [TX^ 문제된 사안으로, 이 사건과 그 구성요건을 전혀 달리하는 별개의 범죄에 관한 것이어서 이 사건에 원용하기 적절하지 아니하다."
322810,판례내용,83,마찬가지로 인용하는 대법원 2004.11.12.
322810,판례내용,84,"선고 2004도5600 판결의 경우, 단순한 보관자이거나 사자에 불과한 중간자에게 금품 등을 주는 행위가 공직선거법 제230조 제1항 제4호의 '제공'에 포함되는지 문제된 사안으로, 이 사건과 그 적용법률이 일부 중첩되기는 하나, 앞서 본 바와 같이 같은 법 제230조 제3항에 따라 가중처벌되는 별개의 독립한 범죄인 선거운동관련 금품제공 ‘요구죄’가 문제되는 이 사건과는 그 주체나 행위 등 구성요건을 달리한다."
322810,판례내용,85,"위 사안은 금품 기타 이익의 귀속주체와 그 금품 기타 이익을 지급받는 상대방이 다른 반면, 이 사건의 경우 피고인들이 그 이익 제공을 ‘요구’한 주체로서 위와 같은 이익의 귀속주체라 주장하는 건설업체나 피고인 A이, 피고인들이나 피고인 B을 그 금품 기타 이익을 직접 지급받는 이른바 ‘중간자’ 내지 ‘사자’로 하여 이익 제공을 요구하였다고 보이지도 않으므로, 위 판결에서 설시한 법리 역시 이 사건에 원용하는 것이 적절하지 않다."
322810,판례내용,86,5)따라서 피고인들의 이 부분 법리오해 주장도 받아들이지 아니한다.
322810,판례내용,87,3.쌍방의 양형부당 주장에 관한 판단
322810,판례내용,88,"가.양형은 법정형을 기초로 하여 형법 제51조에서 정한 양형의 조건이 되는 사항을 두루 참작하여 합리적이고 적정한 범위 내에서 이루어지는 재량 판단으로서, 공판중심주의와 직접주의를 취하고 있는 우리 형사소송법에서는 양형판단에 관하여도 제1심의 고유한 영역이 존재한다."
322810,판례내용,89,"이러한 사정들과 아울러 항소심의 사후심적 성격 등에 비추어 보면, 제1심과 비교하여 양형의 조건에 변화가 없고 제1심의 양형이 재량의 합리적인 범위를 벗어나지 아니하는 경우에는 이를 존중함이 타당하며, 제1심의 형량이 재량의 합리적인 범위 내에 속함에도 항소심의 견해와 다소 다르다는 이유만으로 제1심판결을 파기하는 것은 자제함이 바람직하다(대법원 2015.7.23."
322810,판례내용,90,선고 2015도3260 전원합의체 판결 참조).
322810,판례내용,91,"나.원심은 그 판시와 같이 공직선거법상 선거운동 관련 이익 제공 요구 범행에 대한 엄단 취지, 범행의 경위와 내용 및 그 결과에 비추어 피고인들에 대한 비난가능성이 매우 높고 죄질도 불량하므로 피고인들을 엄하게 처벌할 필요가 있다는 점을 공통된 양형사유로 삼으면서, 피고인 A에 대하여는 이 사건 범행을 인정하고 반성하고 있으며 선거 관련 범죄로 처벌받은 전력은 없는 점을 유리한 정상으로, 증거 인멸을 시도하고 도망하는 등 범행 후 정황이 좋지 않고 다수의 형사처벌 전력이 있는 점을 불리한 정상으로 각 참작하였고, 피고인 B에 대하여는 이 사건 범행을 인정하고 반성하고 있으며 피고인에게 벌금형을 넘는 전과가 없고 선거 관련 범죄로 처벌받은 전력도 없는 점을 유리한 정상으로, C이 이익 제공 요구를 거절하자 더 이상 선거운동을 돕지 않을 것 같은 태도를 보이면서 C을 심리적으로 압박해 재차 이익 제공을 요구하는 등 그 죄질이 나쁜 점을 불리한 정상으로 각 참작한 다음, 피고인들의 나이, 성행, 환경 등 기록에 나타난 양형 조건을 종합하여 피고인들에 대한 형을 정하였다."
322810,판례내용,92,"다.살피건대, 피고인들은 오랜 기간 지역 내에서 자신의 회사 직원들이나 지인들을 이용한 이른바 ‘조직선거’를 사실상 담당해온 사람들로서 정치신인인 C에게 접근하여 불법적인 선거자금을 획득할 목적으로 지역 내 건설업체에 대한 이익 제공을 요구하였고, C이 이를 거부하였음에도 피고인 B은 추가적으로 시장의 인사권 제공을 요구하였으므로, 그 죄질이 불량하고, 그에 대한 이견으로 C과 결별한 것을 보면 이를 단순히 선거전략을 논의하는 과정에서 나온 의견개진이나 의사표시에 머무르는 것이라 볼 수 없다."
322810,판례내용,93,"피고인들은 C이 기자회견으로 이 사건 각 범행을 폭로한 이후 휴대전화를 [TX^ 교체하고 피고인 B은 사무실 PC 하드디스크를 버리는 등 다수의 증거인멸을 시도하였고, 피고인 A은 수사기관의 연락을 회피하면서 도피하기도 하였으므로, 범행 후의 정황도 좋지 못하다."
322810,판례내용,94,"다만 피고인들이 제공을 요구한 사업권이나 인사권의 범위나 그 시기 등이 정확히 특정되진 않고, 이를 위해 사전에 건설업체와 교섭을 진행하거나 인사 대상 인물을 물색하는 등 구체적인 준비행위에 나아갔다는 사정은 찾아볼 수 없으며, 본격적인 선거운동에 돌입하기 전에 C과 결별하였으므로, 이 사건 각 범행이 선거의 결과에 미치는 영향이 크진 않은 것으로 보인다."
322810,판례내용,95,"C이 후보자 직에서 사퇴한 시점과 이 사건 각 범행 사이에는 상당한 시간적 간격이 있고, C이 피고인들과 결별한 이후에도 선거캠프를 유지하면서 선거운동을 지속하였으므로, 이 사건 각 범행이 사퇴의 직접적이거나 결정적인 계기가 되었다고 단정할 수는 없다."
322810,판례내용,96,"그 밖에 피고인들의 나이, 성행, 환경, 범행 후의 정황 등 이 사건 변론에 나타난 양형의 조건들을 종합적으로 고려하면, 양형기준상 권고형의 범위(피고인 A: 징역 10월∼2년 6월, 피고인 B: 징역 10월∼3년 9월) 내에서 원심이 선고한 형이 재량의 합리적인 한계를 벗어나 너무 무겁거나 가볍다고 평가되지 않는다."
322810,판례내용,97,"라.그밖에 피고인들(동종 전력 없음, 지인과 가족들의 탄원 등)과 검사(증거인멸 시도, 금권선거 엄벌 필요성 등)가 이 법원에서 주장하는 양형부당의 사유들은 원심이 피고인들에 대한 형을 정하면서 이미 충분히 고려한 사정들이고, 이외에 이 법원의 양형심리 과정에서 현출된 자료들을 종합하여 보더라도 원심의 양형 판단을 그대로 유지하는 것이 부당하다고 볼 만한 양형 조건의 변화가 없다."
322810,판례내용,98,"마.따라서 원심의 형을 존중함이 타당하므로, 피고인들과 검사의 양형부당 주장을 받아들이지 않는다."
322810,판례내용,99,4.결론
322810,판례내용,100,그렇다면 피고인들과 검사의 항소는 이유 없으므로 형사소송법 제364조 제4항에 따라 이를 모두 기각하기로 하여 주문과 같이 판결한다.
322810,판례내용,101,재판장 판사 백○ _________________________
322810,판례내용,102,판사 이○ _________________________
322810,판례내용,103,판사 강○ _________________________
