판례일련번호,구분,문장번호,내용
322224,판례내용,1,대 구 지 방 법 원
322224,판례내용,2,판 결
322224,판례내용,3,"사 건 2023고단1294 국민체육진흥법위반(도박개장등), 도박공간개설, 범죄수익은닉의규제및처벌등에관한법률위반"
322224,판례내용,4,피 고 인 A
322224,판례내용,5,"검 사○(기소), 윤○(공판)"
322224,판례내용,6,변 호 인 법무법인 시그니처 담당변호사 최○
322224,판례내용,7,판 결 선 고 2023.5.31.
322224,판례내용,8,주 문
322224,판례내용,9,피고인을 징역 1년에 처한다.
322224,판례내용,10,"다만, 이 판결 확정일부터 2년간 위 형의 집행을 유예한다."
322224,판례내용,11,피고인에게 보호관찰을 받을 것과 120시간의 사회봉사를 명한다.
322224,판례내용,12,"피고인으로부터 10,500,000원을 추징한다."
322224,판례내용,13,피고인에게 위 추징금에 상당한 금액의 가납을 명한다.
322224,판례내용,14,이 유
322224,판례내용,15,범 죄 사 실
322224,판례내용,16,"[전제사실] 피고인은 B, C, D, E, F, G, H, I, J, K, L, M, N, O, P, Q, R 등과 불법 스포츠토토 등 도박게임을 제공하는 사이트를 운영하기로 하고, B은 범행을 총괄하는 총책을 담당하면서 도박자를 모집하는 역할을, C은 도박사이트 및 자금 관리, 수익금 분배 등 도박사이트의 전반적인 운영을 위한 관리자 역할을, D은 수익금을 분배받는 조건으로 C의 지시를 받아 자금관리, 종업원 모집·관리, 도박사이트 관리 등 도박사이트 운영을 위한 중간 관리자 역할을, E은 수익금을 분배 받는 조건으로 위 사이트에서 사용할 계좌를 조달하는 역할을, 피고인, F, G, H, I, J, K, L, M, N, O, P, Q, R 등은 위 도박 사이트 회원관리 및 게임머니 충·환전업무를 수행하는 역할을 각각 분담하며 아래와 같이 범행하였다."
322224,판례내용,17,"[범죄사실] 1.국민체육진흥법위반(도박개장등), 도박공간개설 서울올림픽기념국민체육진흥공단과 수탁사업자가 아닌 자는 체육진흥투표권 또는 이와 비슷한 것을 발행하여 결과를 적중시킨 자에게 재물이나 재산상의 이익을 제공하는 행위를 하거나 영리의 목적으로 도박을 하는 공간을 개설하여서는 아니 된다."
322224,판례내용,18,"피고인은 B 등과 공모하여, 2016.10.1.경부터 2017.2.23.경까지 필리핀 마닐라 마카티 시티에 있는 S에서, ‘T (인터넷주소 1 생략)’, ‘U’, ‘V((인터넷주소 2 생략), (인터넷주소 3 생략), (인터넷주소 4 생략), (인터넷주소 5 생략))’, ‘W’, ‘X (인터넷주소 6 생략)’ 등 도박사이트를 순차 개설한 후, 불특정 다수의 도박자들을 회원으로 모집하여 회원으로부터 주식회사 Y 명의의 Z은행 계좌(계좌번호 1 생략)등으로 돈을 입금 받은 후 그 금액에 상당한 게임머니를 부여하여 회원들로 하여금 위 사이트에 게시된 국내외 각종 스포츠 경기 등의 승패를 예상하여 게임머니를 베팅하게 하고, 그 예상이 적중한 경우 미리 정해진 배율에 따른 상금을 부여하고, 그 예상이 빗나가는 경우 베팅한 게임머니를 몰수한 후, 남은 게임머니를 회원의 계좌로 환전해주는 방법으로 별지 범죄일람표 기재와 같이 주식회사 Y 명의의 Z은행 계좌 등 16개의 계좌를 이용해 충전금액 합계 10,653,985,233원 규모의 도박 사이트를 운영하였다."
322224,판례내용,19,"이로써 피고인은 B 등과 공모하여, 서울올림픽기념국민체육진흥공단과 수탁사업자가 아니면서 체육진흥투표권 또는 이와 비슷한 것을 발행하여 결과를 적중시킨 자에게 재물이나 재산상 이익을 제공하는 행위를 함과 동시에 영리의 목적으로 도박을 하는 공간을 개설하였다."
322224,판례내용,20,"2.범죄수익은닉의규제및처벌에관한법률위반 도박공간개설죄는 범죄수익은닉의 규제 및 처벌 등에 관한 법률에서 규정한 중대범죄에 해당하고, 누구든지 이러한 중대범죄에 해당하는 범죄행위에 의하여 생긴 재산 또는 그 범죄행위의 보수로 얻은 재산과 같은 범죄수익의 발생 원인에 관한 사실을 가장하여서는 아니 된다."
322224,판례내용,21,"그럼에도 피고인은 B 등과 공모하여, 2016.10.1.경부터 2017.2.23.경까지 필리핀 마닐라 마카티 시티에 있는 S에서, 위 1항과 같이 불법 도박사이트인 ‘T (인터넷주소 1 생략)’, ‘U’, ‘V((인터넷주소 2 생략), (인터넷주소 3 생략), (인터넷주소 4 생략), (인터넷주소 5 생략))’, ‘W’, ‘X (인터넷주소 6 생략)’ 등을 운영하면서, 위 도박사이트에 접속한 불특정 다수의 회원들로부터 별지 범죄일람표 기재와 같이 주식회사 Y 명의의 Z은행 계좌(계좌번호 1 생략)등 16개의 타인 명의 금융계좌로 게임머니 구입대금 명목으로 합계 10,653,985,233원을 입금받아 범죄수익의 발생 원인에 관한 사실을 가장하였다."
322224,판례내용,22,"증거의 요지 1.피고인의 법정진술 1.C, E, L, N, M, AA에 대한 각 경찰 피의자신문조서 1.O, P, R, Q의 각 경찰 진술서 1.각 수사보고서(순번 26 내지 29, 28, 134, 137 내지 145, 183, 187, 197)1.수사보고(추징액 산정)1.개인별 출입국 현황 법령의 적용 1.범죄사실에 대한 해당법조 국민체육진흥법 제47조 제2호, 제26조 제1항, 형법 제30조(체육진흥투표권발행유사행위의 점), 형법 제247조, 제30조(도박공간개설의 점), 범죄수익은닉의 규제 및 처벌 등에 관한 법률 제3조 제1항 제2호, 형법 제30조(범죄수익의 발생 원인에 관한 사실 가장의 점)1.상상적 경합 형법 제40조, 제50조 [국민체육진흥법위반(도박개장등)죄와 판시 제1항 도박공간개설죄 상호간, 형이 더 무거운 국민체육진흥법위반(도박개장등)죄에 정한 형으로 처벌] 1.형의 선택 각 징역형 선택 1.경합범가중 형법 제37조 전단, 제38조 제1항 제2호, 제50조 1.집행유예 형법 제62조 제1항(아래 양형의 이유 중 유리한 정상 참작)1.보호관찰 및 사회봉사명령 형법 제62조의2 제1항 1.추징 국민체육진흥법 제51조 제3항 1.가납명령 형사소송법 제334조 제1항 양형의 이유 이 사건 범행은 누구나 쉽게 접근이 가능하여 국민의 과도한 사행심을 조장하고 건전한 근로의식을 저해할 수 있는 인터넷 도박사이트를 개설ㆍ운영한 것이므로 그 죄질이 좋지 아니한 점, 피고인은 국내 사법권이 미치지 않는 해외에 운영 사무실을 둔 불법 도박사이트 운영에 가담하였고, 이 사건 도박사이트의 규모가 상당히 큰 점 등을 고려하면 그 죄책이 가볍지 아니한 점 등은 피고인에게 불리한 정상이다."
322224,판례내용,23,"다만, 피고인이 이 사건 범행을 인정하고 약 2개월 동안 구금생활을 하면서 반성의 시간을 가졌을 것으로 보이는 점, 피고인은 고용되어 지시에 따라 도박자금의 충․환전업무 등을 담당하는 등 이 사건 사이트 운영의 일부에 가담한 것이고, 이 사건 범행으로 인한 취득한 이익이 비교적 많지 아니한 점, 피고인은 범죄전력이 없는 초범인 점 등을 피고인에게 유리한 정상으로 참작하여 피고인에게 기회를 주어 징역형의 집행을 유예하는 판결을 선고하되, 재범방지 등을 위하여 보호관찰을 받을 것에 더하여 사회봉사명령을 명하기로 하고, 그 밖에 공범들과의 형평성 및 피고인의 연령, 성행, 환경, 범행의 동기, 수단과 결과, 범행 후의 정황 등 이 사건 기록 및 변론에 나타난 양형조건을 종합하여 주문과 같이 형을 정한다."
322224,판례내용,24,판사 문○
