판례일련번호,구분,문장번호,내용
322827,판례내용,115,"그렇다면 사실상 대출금으로 매매대금이 전부 지급된 이 사건에서, 위와 같이 그 대출금의 이자를 매수 명의인이 아닌 피고인 A, B, C, E가 부담하였다는 사정은 위 피고인들로 구성된 동업체가 이 사건 임야의 실제 매수인임을 뒷받침하는 유력한 정황에 해당한다."
322827,판례내용,116,⑤ 한편 2020.3.2.
322827,판례내용,117,"피고인 C의 제수인 BD를 대표이사(이후 피고인 F의 딸인 BE로 대표이사가 변경되었다), 피고인 F을 감사, Q을 이사로 하여 주식회사 BF이 설립되었는데, 위 회사의 주주명부(증거기록 2905쪽)에는 BD가 50%, 피고인 E가 2,500주, S이 2,500주를 보유하는 것으로 기재되어 있다."
322827,판례내용,118,"피고인 F은 검찰조사에서 이 사건 대출 이자를 지급하기 위한 수익사업을 하려고 위 회사를 설립했고, 피고인 A, B, C도 자본금의 50%인 5,000만 원을 출자하였다고 진술하였는데, 피고인 E, C도 이에 부합하는 진술을 하였으며, 실제 피고인 C이 위 회사 설립 직전인 2020.2.20."
322827,판례내용,119,"BD의 계좌로 5,605만 원을 송금한 내역도 확인된다."
322827,판례내용,120,"그러나 위 회사 설립 및 그 이후 운영과정에 위 피고인들을 제외한 Y, Z 등 이 사건 임야의 매수 명의인들이 관여하였다고 볼만한 정황은 확인되지 않는다."
322827,판례내용,121,"⑥ M 임야의 매수 명의인 Y과 N 임야의 매수 명의인 Z은 당심 법정에 증인으로 나와 명의신탁약정을 체결한 사실이 없다고 진술하였으나, 위 매수 명의인들은 실질 매매계약 체결장소에 참석하지도 않았고, 실질 매도인인 피고인 D나 피고인 F, E도 계약 체결 당시에는 위 매수 명의인들과 피고인 B, C 사이의 관계에 대해 정확히 알지 못했다고 진술하였다."
322827,판례내용,122,"실제 위 매수 명의인들은 증언 과정에서 대출이자를 다른 사람이 내줬는지 질문하자 아니라거나 자신의 통장에서 바로 납입했다고 증언하는 등 매매계약의 체결 경위나 그 이후 대출 이자 납입경위에 대해서도 정확히 알고 있지 못한 것으로 보이고, 위 매수인들과 피고인 B, Z과의 관계 등을 고려할 때, 위 증언내용은 그대로 믿기 어렵다."
322827,판례내용,123,"4.특정경제범죄가중처벌등에관한법률위반(배임)의 점에 관한 피고인 A, B, C의 사실오인 및 법리오해 주장에 관한 판단"
322827,판례내용,124,가.관련 법리
322827,판례내용,125,배임죄는 현실적인 재산상 손해액이 확정될 필요까지는 없고 단지 재산상 권리 실행을 불가능하게 할 염려 있는 상태 또는 손해 발생의 위험이 있는 경우에 바로 성립되는 위태범이다(대법원 2000.4.11.
322827,판례내용,126,"선고 99도334 판결, 대법원 2011.5.26."
322827,판례내용,127,선고 2011도2150 판결 등 참조).
322827,판례내용,128,"배임죄에 있어서 '재산상 손해를 가한 때'라 함은 현실적인 손해를 가한 경우뿐만 아니라 재산상 실해 발생 위험을 초래한 경우도 포함되고, 일단 손해 위험성을 발생시킨 이상 사후에 피해가 회복되었다 하여도 배임죄 성립에 영향을 주는 것은 아니다(대법원 2004.5.14."
322827,판례내용,129,선고 2001도4857 판결 등 참조).
322827,판례내용,130,"금융기관 직원들이 대출을 하면서 대출채권 회수를 확실하게 하기 위하여 충분한 담보를 제공받는 등 여신규정에 따른 상당하고도 합리적인 조치를 강구함이 없이 만연히 대출을 해 주었다면 임무위배 행위로 제3자로 하여금 재산상 이득을 취득하게 하고 금융기관에 손해를 가한다는 인식이 있었다고 볼 것이고, 그와 같은 자금대여는 타인에게 이익을 얻게 하고 금융기관에 손해를 가하는 행위로서 회사에 대하여 배임행위가 된다(대법원 2006.10.26."
322827,판례내용,131,"선고 2004도8106 판결, 대법원 2018.1.25."
322827,판례내용,132,선고 2014도13344 판결 등 참조).
322827,판례내용,133,나.판단
322827,판례내용,134,"위와 같은 법리에 기초하여 보건대, 원심 및 당심이 적법하게 채택하여 조사한 증거로 인정할 수 있는 다음과 같은 사정을 종합하면, 이 사건 H 임직원인 피고인 A, B, C은 감정평가가액을 부풀리는 등 대출규정에 따른 상당하고도 합리적인 조치를 강구함이 없이 만연히 대출을 해 주었고, 이러한 위 피고인들의 임무위배 행위로 인하여 이 사건 H에 재산상 실해 발생 위험이 초래되었으며, 위 피고인들에게 배임의 고의도 인정된다고 봄이 타당하다."
322827,판례내용,135,따라서 위 피고인들의 이 부분 사실오인 및 법리오해 주장은 받아들이지 아니한다.
322827,판례내용,136,"1)피고인 A, B, C은 이 사건 H에서 대출금을 안정적으로 회수하기 위하여 마련한 담보 부동산의 감정평가방법, 담보대출 가능금액 관련 규정을 위반하여 이 사건 대출을 실행하였다."
322827,판례내용,137,"금융기관이 부동산 등 담보대출 업무와 관련하여 대출금의 안정적인 회수와 이를 통한 자산건전성을 확보하기 위해 명시적 대출규정을 마련하였다면 이는 그 정도 기준을 충족하는 경우라야 채권 회수에 문제가 없으리라는 사전 판단에 근거한 것이므로, 그럼에도 당해 금융기관 임직원이 그 대출규정에서 정한 기준을 위반하여 대출을 한 경우라면, 특별한 사정이 없는 한 당해 금융기관으로서는 그 대출 당시에 이미 채권회수가 불확실해지는 등으로 재산상 실해 발생 위험에 처하게 되었다고 추정할 수 있다."
322827,판례내용,138,"이에 대해 피고인들은 T 여신업무방법서는 그 내용이 방대하여 세부적인 내용까지 정확히 숙지하기 어려웠고, 당시 이 사건 H와 같은 지방의 소규모 H에서는 5억 원 이하의 소액 대출에 대해서는 외부감정 없이 거래사례비교법 등 자체 감정을 실시하는 관행이 존재하였다고 주장한다."
322827,판례내용,139,"그러나 배임죄에 있어서 임무에 위배하는 행위라 함은 처리하는 사무의 내용, 성질 등 구체적 상황에 비추어 법령의 규정, 계약의 내용 또는 신의칙상 당연히 하여야 할 것으로 기대되는 행위를 하지 않거나 당연히 하지 않아야 할 것으로 기대되는 행위를 함으로써 본인과의 신임관계를 저버리는 일체의 행위를 의미하는바(대법원 2004.7.9."
322827,판례내용,140,"선고 2004도810 판결 참조),"
322827,판례내용,141,"① T 여신업무방법서에서 임야(제354조)와 개발행위허가를 득한 임야(제244조 제3항 제4호)에 대한 감정평가방법이 명시되어 있고 별도의 예외를 두고 있지 않은 점,"
322827,판례내용,142,"② 이처럼 해당 업무에 관하여 이미 상세하고 명확한 업무처리규정이 있는 이상, 다른 대출사례가 일부 존재한다는 사정만으로는 위 규정에 명시적으로 반하는 업무 관행이 형성되어 있다고 보기 부족한 점,"
322827,판례내용,143,"③ 여신업무방법서상 감정평가방법에 제한을 둔 취지는 객관적인 담보가치 평가로 인한 대출금의 안정적 회수에 있으므로, 다른 금융기관과 사이의 경쟁력 확보나 업무 편의 등의 사유만으로 위 규정에 반하는 업무 처리가 쉽게 정당화 된다고 볼 수 없는 점,"
322827,판례내용,144,"④ 특히 이 사건 대출의 경우 해당 금융기관 임직원이 속한 동업체에서 대출을 받는 것이므로, 업무처리의 객관성을 확보하기 위해 해당 업무규정을 더욱 엄격하게 준수할 필요가 있는 점,"
322827,판례내용,145,"⑤ T의 여신업무방법서는 각 H마다 배치되어 있을 뿐만 아니라 전산상으로도 조회가 가능하므로, 피고인 A, B, C의 T 근무 경력에 비추어 위 대출규정에 대해 알았거나 조금만 주의를 기울였더라도 쉽게 알 수 있었을 것으로 보이는 점(피고인 C은 AG의 감사과정에서 규정에 따라 공시지가기준법으로 감정할 경우 대출가능금액이 현저히 낮아 거래사례를 기준으로 감정평가했다고 진술하였다),"
322827,판례내용,146,"⑥ 위 피고인들도 AG의 감사과정에서 잘못된 감정평가방법을 적용한 것은 인정한다고 진술하였고, 이 사건 H의 직원(AX)도 당심 법정에서 임야의 경우 원래 공시지가로만 감정해야 하는 것으로 알고 있었다고 진술한 점,"
322827,판례내용,147,"⑦ 2차 대출 부동산에 대한 자체감정평가액은 합계 10,361,197,000원으로 외부감정평가액인 1,900,563,000원(증거기록 399쪽 감정평가서 참조)의 5배를 초과하는 점을 종합하여 볼 때, 위 대출규정을 위반한 감정평가 및 이 사건 대출실행은 이 사건 H에 대한 배임행위에 해당한다고 평가함이 타당하다."
322827,판례내용,148,따라서 위 피고인들의 주장은 받아들이지 아니한다.
322827,판례내용,149,"2)다음과 같은 사정에 비추어 볼 때 이 사건 임야는 이 사건 대출채권의 회수를 확실하게 하기 위한 충분한 담보라고 볼 수 없고, 피고인들이 이 사건 임야에 근저당권을 설정한 것 외에 AG의 감사가 있기 전까지 별도로 대출채권의 안정적인 회수를 위하여 필요한 상당하고도 합리적 조치를 취하였다고 볼 수도 없다."
322827,판례내용,150,"① 피고인 A의 변호인은 이 사건 임야의 실제 매매대금이 59억 5,750만 원으로 이 사건 대출액을 훨씬 초과한다는 점을 강조한다."
322827,판례내용,151,"그러나 위 매매대금은 피고인 D의 온천수 개발이 완료됨을 전제로 책정된 금액으로서(피고인 C도 검찰조사에서 인근 시세를 알아보고 온천수 비용이 포함된 금액이 적정하다고 생각했다고 진술하였다), 실제 이 사건 임야의 소유권은 이 사건 대출금(34억 1,500만 원)이 매도인 측에 지급됨과 동시에 각 매수인별로 이전되었고, 각 매매계약에서 D의 온천수 개발 완료를 잔금 지급의 조건으로 삼고 있었으므로, 위 매매대금에는 온천수 개발에 따른 장래의 개발이익이 반영되어 있다고 봄이 상당하다."
322827,판례내용,152,따라서 위 매매가격이 거래 당시 이 사건 임야의 객관적인 담보가치를 반영하고 있다고 보기는 어렵다.
322827,판례내용,153,"피고인 A, B, C은 이 사건 임야 인근에 강화군에서 운영하는 온천시설이 있었으므로, 온천수 개발의 실현가능성이 높다고 판단했다고 주장한다."
322827,판례내용,154,그러나 이 사건 임야의 매매계약에서 예정되었던 기간인 2년이 훨씬 경과한 현재까지 온천수 개발계획이 현실화되었다고 볼만한 자료는 확인되지 않는다.
322827,판례내용,155,"수사기관이 강화군청 담당 공무원과 통화한 내용(증거기록 2615쪽)에 의하더라도, 피고인 D가 2019.3.28."
322827,판례내용,156,"인천 강화군 BG 토지에 대해 지하수개발 허가 신청을 하였으나 온천 개발을 위한 굴착허가신청을 한 것은 아니고, 다만 지하수 개발을 하다가 하루에 온도 25℃ 이상으로 300톤 이상의 물이 나오면 온천수 효능 검사를 통해 온천 변경 신고를 할 수 있으나, 아직까지 피고인 D가 관할관청에 온천 변경신고를 하였다는 자료는 제출되지 아니하였다."
322827,판례내용,157,"온천 개발을 약속한 피고인 D도 돈이 없어서 개발을 하지 못했다고 주장할 뿐, 실제 개발이 이루어지지 못한 이유를 제대로 설명하지 못하고 있고, 달리 온천수 개발의 가능성이 있다고 인정할 만한 자료는 찾아볼 수 없다."
322827,판례내용,158,"이러한 사정에 비추어 볼 때, 피고인 A, B, C은 객관적인 근거 없이 막연히 피고인 D의 온천수 개발 약속을 신뢰하여 이를 이 사건 임야의 감정평가에 반영했던 것으로 보인다."
322827,판례내용,159,"② 피고인 A, B, C은 AG의 정기 감사과정에서 BH감정평가법인이 실시한 이 사건 임야에 대한 감정평가결과(증거기록 358쪽 이하)에 대해 AG의 의뢰로 이루어진 것으로 객관성이 담보되지 아니하고, 잘못된 비교표준지를 선정함으로써 부당하게 이 사건 임야의 가액을 낮게 평가한 것이라고 주장한다."
322827,판례내용,160,"그러나 BH감정평가법인은 이 사건 임야와 이용 상황, 지목, 현황 등이 유사한 토지를 비교표준지로 삼아, 이 사건 임야와의 교통편의, 경사 차이, 감정평가전례나 거래사례 등을 보정요인으로 고려해 공시지가기준법에 따라 감정평가를 진행한 것으로 보이고, 1차 대출 부동산의 경우 개발행위(산지전용)허가가 이루어져 평지로 조성되었거나 조성 중에 있음을 감안하여 그 가액을 평가하였다."
322827,판례내용,161,"감정평가에 관한 규칙 제14조 제1항에서 토지 감정평가시 공시지가기준법이 원칙임을 규정하고 있고, 위 감정평가서 내용을 다시 살펴보더라도, 그 감정과정이 경험칙에 반하거나 현저히 합리성을 결여하였다고 보기 어려우며, 위 피고인들의 주장과 같이 AG에서 감정평가 과정에 관여하였다거나 그 감정결과가 다른 거래사례나 평가전례에 크게 어긋난다고 볼만한 사정도 찾아볼 수 없다."
322827,판례내용,162,"오히려 피고인 C이 이 사건 임야에 대한 자체감정평가 과정에서 고려하였다는 거래사례 대상 토지인 인천 강화군 BI, BJ, BK 토지의 경우 BL 토지에서 분할된 토지로서, 그 등기사항전부증명서(증거기록 2174쪽)에 의하면, 피고인 D가 2008.12.22."
322827,판례내용,163,"공유물 분할로 위 BL 토지의 소유권을 취득한 다음 이를 분할하여 매도한 것으로 보이는바, 해당 토지의 위치를 고려할 때 이 사건 임야와 마찬가지로 온천수 개발에 따른 장래의 기대이익이 매매대금에 반영되었을 가능성이 있으므로, 거래사례비교법의 기초가 되는 객관적인 평가자료에 해당하지 아니할 여지가 상당하다(T 여신업무방법서 제320조 제4항 라목1)참조)."
322827,판례내용,164,③ 이 사건 임야에 대한 자체감정평가 당시 위 부동산에 대한 온천수 개발이 근시일내로 가능하다거나 그 전제가 되는 작업이 구체적으로 실행되고 있었다고 볼만한 사정은 찾아볼 수 없다.
322827,판례내용,165,"온천수 개발은 그 전제로서 산지전용에 따른 개발행위의 완료도 함께 이루어져야 하는데, 피고인 A, B, C, F, E는 추가로 투자금 4억 원을 마련하였을 뿐, 이 사건 대출 당시 별다른 자금조달계획을 마련하지 못한 상황이었고, 위 투자금 4억 원도 대출이자의 납입 등 각종 비용에 대부분 소비되었으므로, 온천수 개발을 포함한 부동산 개발사업의 실현을 장담할 수 없는 상황이었다."
322827,판례내용,166,"피고인 A, B, C은 1)거래사례비교법 업무요령은 통상적인 시장의 존재를 전제로 하여 거래사례를 파악할 수 있는 경우에 적용할 수 있으며, 객관적인 평가자료로 인정되는 경우는 다음 각 호와 같다."
322827,판례내용,167,"다만 객관적인 평가자료가 없는 경우에는 공인감정평가를 하여야 한다(검인된 매매계약서, 등기부상 매매가격, 경매낙찰허가서, 공인감정담보평가서 등을 객관적인 평가자료로 들고 있다)."
322827,판례내용,168,직접 위 개발 사업을 동업으로 추진하면서 이러한 상황을 누구보다 잘 알고 있었음에도 마치 곧 온천수 개발이 이루어질 것처럼 사업전망을 긍정적으로 평가해 이를 직접 또는 AC를 통해 감정평가에 반영한 것으로 보인다.
322827,판례내용,169,"④ 피고인 A, B, C, F, E는 원심에서 곧 이 사건 임야에 대한 매매계약이 체결될 예정이라면서 ㈜BM 명의의 2022.12.9.자 매수의향서를 첨부하여 선고연기를 신청하기도 하였으나, 그 매매계약이 실현되지 않은 것으로 보인다."
322827,판례내용,170,"피고인 B, C의 변호인은 당심 변론종결 후인 2023.11.16."
322827,판례내용,171,"이 사건 임야 중 M, N, L 임야에 대해 그 가액이 2,514,000,000원임을 전제로 하는 부동산 교환계약이 2023.7.10."
322827,판례내용,172,"체결되었다는 취지의 증거자료(증 제6호증의 1 내지 5)를 제출하였으나, 현재까지 계약금의 지급 및 가등기의 설정 외에 위 교환계약에서 예정된 교환조건이 실제로 이행되었다고 볼만한 자료는 제출되지 아니하였다."
322827,판례내용,173,이처럼 위 피고인들의 오랜 기간 노력에도 불구하고 이 사건 임야의 매매가 쉽게 이루어지지 않고 있는 점은 과연 이 사건 임야가 피고인들이 평가한 담보가치에 걸맞은 환가성을 갖추고 있는지 상당한 의구심을 갖게 하는 정황이다.
322827,판례내용,174,"3)아래와 같은 사정에 비추어 볼 때, 대출 명의자들의 상환능력이, 앞서 본 이 사건 임야의 담보가치 부족에 따른 우려를 불식시키는 데에 충분하다고 보기도 어렵다."
322827,판례내용,175,"① 피고인 A, B, C은 자신들이 보유한 예금이나 소유한 부동산 내역을 통해 이 사건 대출금을 상환할 충분한 능력을 갖추고 있음을 강조하고 있다."
322827,판례내용,176,"그러나 위 피고인들은 별지 범죄일람표 연번 1 내지 3 기재 대출의 담보제공자에 불과한데 해당 대출금액은 총 549,000,000원으로 총 대출금액의 16% 정도이고, 나머지 대출에 대하여는 위 피고인들이 대출채무자나 보증인으로서 상환책임을 부담한다고 보기 어렵다."
322827,판례내용,177,"위 피고인들이 AG의 감사 이후 나머지 대출까지 포함하여 자신들과 친인척들의 보유 예금 등을 추가 담보로 제공한 것은 사후적 사정으로 배임죄의 성립 여부에 영향을 주지 않는다.② 특히 피고인 A, B, C, F, E 사이의 동업약정에 의하면, AO, L 임야에 대한 대출금의 상환은 피고인 F이, O, P 임야에 대한 대출금의 상환은 피고인 E가 각 책임지기로 되어 있는데, 피고인 F, E는 과거 사업실패로 인해 신용불량자인 상태이고, 위 피고인들이 별도의 재산을 보유하고 있다고 볼만한 사정은 찾아볼 수 없으므로, 총 683,000,000원에 달하는 각 대출금을 상환할 능력이 있다고 보기 어렵다."
322827,판례내용,178,"피고인 E○는 검찰조사에서 피고인 F이 대출금 이자도 내지 못해 자신이 대신 납부하면서 AO 임야에 대한 대출금 중 1억 원도 대신 상환하였다고 진술하였고, 자신도 사업이 다 망해서 자식들에게 물려줄 재산이 없고, 이혼한 뒤 보증금 3,800만 원의 임대주택에서 혼자 살고 있다고 진술하였다."
322827,판례내용,179,"③ 피고인 A, B, C은 대출채무자들의 신용등급이 우량해서 상환능력에 문제가 없다는 점을 강조한다.그러나 앞서 본 바와 같이 별지 범죄일람표 연번 1 내지 3 기재 대출을 제외한 나머지 대출의 경우 대출채무자들이 명의만 빌려준 것이므로, 각 대출채무자들이 적극적인 상환의지나 충분한 상환능력을 가지고 있다고 단정할 수 없다."
322827,판례내용,180,"특히 L 임야에 대한 담보대출의 채무자인 S은 근로소득 원천징수영수증(증거기록 1178쪽)상 2018년도 연소득이 2,144만 원에 불과하고, 별도의 재산세 납부내역도 없으므로, 5억 원에 달하는 대출금을 상환할 능력이 충분하였던 것으로 보이지도 않는다."
322827,판례내용,181,"다른 대출채무자인 W, X, Z의 경우에도 그 2018년도 연 소득액(W: 3,543만 원, X: 5,161만 원, Z: 3,384만 원)이나 자산 보유 내역, 기존 대출상황(W: 2억 6천만 원, X 4,800만 원, Z: 1억 8,431만 원)을 고려할 때, 5억 원에 달하는 대출금을 상환할 능력을 충분히 갖추었다고 확신할 수 없다."
322827,판례내용,182,"별지 범죄일람표 연번 6 내지 10 기재 각 대출의 경우, 예정한 여신기간이 3년 넘게 지난 현재까지 각 대출금 채무 대부분이 원금이 상환되지 않은 채 그대로 남아있다."
322827,판례내용,183,"④ 피고인 A, B, C이 근거로 들고 있는 대법원 판례(대법원 2008.6.19."
322827,판례내용,184,"선고 2006도4876 전원합의체 판결)는 T 동일인 대출한도 제한규정 위반이 문제된 사안에서 ‘동일인 대출한도 제한규정은 T 자체의 적정한 운영을 위하여 마련된 것이지 대출채무자의 신용도를 평가하여 대출채권 회수가능성을 직접적으로 고려하여 만들어진 것은 아니므로, 동일인 대출한도를 초과하였다는 사실만으로 곧바로 대출채권을 회수하지 못하게 될 위험이 생겼다고 볼 수 없다’는 취지로 판시한 것인 반면, 이 사건에서 위 피고인들은 동일인 대출한도 제한규정을 위반하였을 뿐만 아니라, 대출금의 안정적인 회수를 위해 직접적인 제한을 둔 감정평가방법에 관한 규정을 위반하여 대출을 실행하였고, 앞서 본 바와 같이 대출채무자의 상환능력도 부실하여 대출금을 회수하지 못할 위험이 발생하였다고 볼 수 있으므로, 위 대법원 판례는 이 사건과는 사안이 달라 원용하기에 적절하지 아니하다."
322827,판례내용,185,"⑤ 아래와 같은 이 사건 대출과정이나 온천개발사업의 진행경과, 피고인 E, F의 진술, 피고인 A, B, C의 업무처리 내역 등에 비추어 보면, 피고인 D를 제외한 나머지 피고인들은 공모하여, 온천개발을 장담하기 어려운 상황에서 이 사건 대출금을 전부 회수하지 못할 수도 있다는 점을 적어도 미필적으로나마 인식하였음에도 충분한 담보를 제공받는 등 상당하고 합리적인 채권회수조치를 취하지 아니한 채 만연히 이 사건 대출을 실행하였다고 볼 수 있다."
322827,판례내용,186,"⑥ 앞서 본 바와 같이 이 사건 대출은 피고인 A, B, C, E, F으로 구성된 동업체가 ‘온천개발을 통한 시세차익 실현’이라는 목적을 달성하기 위해 실행한 것이므로, 손해 발생 위험이나 그에 대한 위 피고인들의 인식 여부는 이 사건 대출의 전 과정을 전체적으로 보아 판단하여야 하고, 개별 대출별로 채무자의 상환능력이나 담보가치를 나누어 판단하여야 하는 것은 아니다."
322827,판례내용,187,"⑦ 앞서 본 바와 같이 이 사건 대출 당시 실제 매수인 중 피고인 F, E는 신용불량자로서 대출금 상환능력이 충분치 못한 상황이었고, 같은 동업자로서 대출 실행을 담당한 피고인 A, B, C도 이러한 사정에 대해 인식하고 있었다고 봄이 상당하다."
322827,판례내용,188,"나아가 이처럼 특정 대출부분을 책임지기로 한 동업자 중 일부의 채무 상환능력에 상당한 문제가 있다고 인정되는 이상, 다른 동업자들의 상환능력이나 법률상 책임 범위는 별론으로 하더라도 경제적인 관점에서 이 사건 H가 대출금 전부를 온전히 회수하지 못할 현실적 위험은 초래되었다고 평가할 수 있다."
322827,판례내용,189,⑧ 피고인들이 이 사건 대출과정에서 대출명의자들의 상환능력에 대해 충분한 검토를 하였다고 보기도 어렵다.
322827,판례내용,190,"실제 별지 범죄일람표 연번 6 내지 10 기재 각 대출과정에서 작성된 각 상환능력확인서(증거기록 717, 896, 1161, 1354, 1516쪽)를 보더라도, 채무자의 연소득란이나 상담자 의견란은 공란으로 되어 있다."
322827,판례내용,191,"위 대출서류에 채무자들의 재직증명서나 소득증빙서류, 재산세 납부내역, 신용조회서 등이 첨부되어 있으나, 5억 원에 이르는 대출금을 상환할만한 변제 자력을 갖추었는지에 대해 실질적으로 심사하였다고 볼만한 사정은 찾아볼 수 없다."
322827,판례내용,192,"위 각 대출과정의 담당자였던 AC는 AG의 감사과정에서 채무자들이 소득이 많지 않다는 사실은 확인했지만 대출 이자 정도는 충분히 납부할 수 있을 것이라고 검토했고, 대출금액이 과다하다고 생각했지만 온천 등 미래적 가치가 있다고 판단하였다고 진술하였다."
322827,판례내용,193,"⑨ 피고인 A, B, C은 이 사건 대출이 대출심의위원회의 의결을 거쳐 이루어졌다는 점을 강조한다."
