판례일련번호,구분,문장번호,내용
326026,판례내용,102,3)피해자는 피고인을 2022.3.22.
326026,판례내용,103,화요일 오전에 고소하였다.
326026,판례내용,104,피해자로서는 공공근로로 인해 이 사건 이후 최초로 피고인을 마주칠 수밖에 없는 날이기도 하다.
326026,판례내용,105,"피고인을 수사기관에 고소하지 않거나 제3자에게 피해 사실을 밝혀 도움을 요청하지 않을 경우 공공근로를 나가 피고인을 마주해야 했던 상황에서, 피해자는 공공근로를 하기 전날 F과 E을 직접 만나 피해 사실을 호소하였던 것으로 보인다."
326026,판례내용,106,피해자가 당시 피고인을 다시 마주칠 수밖에 없는 상황을 크게 우려하였음을 보여주는 사정이다.
326026,판례내용,107,이 사건 고소 시점 및 경위는 이 사건 범행 직후 피해자의 피고인에 대한 두려움이 얼마나 컸는지를 간접적으로나마 표시해주고 있다.
326026,판례내용,108,"마.반면, 피고인의 변소는 이 사건 범행 직후 피고인에 대한 피해자의 반응이나, 고소 시점에 비추어, 납득하기 어렵다."
326026,판례내용,109,"1)피고인은 이 사건 당일 피해자가 먼저 피해자의 과거 이성관계와 관련된 이야기를 꺼내며 피고인에게 성관계를 제안한 것이고, 피고인이 발기가 되지 않아 피고인의 성기를 삽입하지 못하자 피고인에게 ”다음에는 약 좀 먹고 해줘라“라는 말까지 하였다고 주장한다."
326026,판례내용,110,"사실상 피해자의 적극적인 권유에 따라 피해자의 신체를 만지고, 성관계를 시도하게 되었다는 것이다."
326026,판례내용,111,"2)피고인의 주장은 피해자와 사이에 추가적인 성관계도 약속하였다는 것인데, 앞서 본 바와 같이 피해자는 이 사건 범행일로부터 불과 3일밖에 경과하지 않은 2022.3.21.경 피해자의 집에 수차례 찾아와 현관문을 두드린 피고인에게 문조차 열어주지 않았다."
326026,판례내용,112,이 사건 범행 이후 피고인이 피해자의 집에 다시 찾아갈 때까지 피고인과 피해자가 휴대전화 등을 통하여 서로 연락한 사실은 없다.
326026,판례내용,113,"피고인의 주장대로라면, 적어도 피해자가 피고인을 반갑게 맞이하는 것이 자연스러울 것이나 피해자의 행동은 정반대로 나타났다."
326026,판례내용,114,3)피고인은 이 사건 당일 피해자의 주거지에 두고 온 이어폰을 찾아가기 위해 2022.3.21.
326026,판례내용,115,"피해자의 집에 방문하였는데, 피해자는 수사기관에 피고인이 방문하기 하루 전인 2022.3.20."
326026,판례내용,116,수납장 위 가방에 보관하고 있던 피고인의 이어폰을 홧김에 복도 밖에 버렸다고 진술하였다(증거기록 제46쪽).
326026,판례내용,117,이 역시 피고인이 주장하는 이 사건 직후 피해자의 피고인에 대한 감정이나 태도와 배치된다.
326026,판례내용,118,"4)피고인은 피해자가 금전을 목적으로 피고인을 허위로 고소하였다고도 주장하나, 피해자는 이 사건 이후 고소를 하기 직전이나 수사 및 재판이 진행되는 동안 피고인에게 별도의 합의금을 요구한 사실조차 없다."
326026,판례내용,119,피해자가 허위의 사실을 꾸며내어 피고인을 무고할 만한 동기나 정황은 찾아볼 수 없다.
326026,판례내용,120,"5)피고인은 수사기관에서 “그날 그 사람(피해자)에게 약을 먹고 해달라는 말을 들은 사실이 있습니까?”, “당신이 그날 그 사람에게 약을 먹고 해달라는 말을 들었습니까?”, “그날 그 사람에게 약을 먹고 해달라는 말을 들었던 사람이 당신입니까?라는 질문지에 대하여 모두 “예”라고 답하였고, 피고인의 위 답변에 대한 폴리그래프 검사 결과 ‘진실반응’으로 판독되는 생리반응이 나타났다."
326026,판례내용,121,"그러나 폴리그래프 검사 결과는 검사를 받는 사람의 진술의 신빙성을 가늠하는 정황증거로서 기능을 하는 데 그치므로, 피고인에 대한 검사결과가 ‘진실’ 반응으로 나왔다고 하여 피해자의 진술의 신빙성을 반드시 배척하여야 하는 것은 아닐 뿐만 아니라(대법원 2017.1.25."
326026,판례내용,122,"선고 2016도15526 판결 참조), 피해자는 피해자가 아닌 피고인이 다음엔 약을 먹고 해주겠다라는 말을 하였다고 진술하는바, 당시 적어도 피해자와 피고인 사이의 대화 과정 중에 “약(비아그라)”이라는 단어가 실제 사용된 사실이 있었던 점에 비추어, 피고인에 대한 거짓말탐지기 검사결과가 피고인 스스로의 편협된 사고방식과 착각으로 인한 결과일 가능성을 전혀 배제할 수 없다."
326026,판례내용,123,위 폴리그래프 결과를 피해자 진술의 신빙성을 곧바로 배척하거나 피고인의 변소를 그대로 받아들여야 하는 사정으로 받아들일 수는 없다.
326026,판례내용,124,양형의 이유 1.법률상 처단형의 범위: 징역 9개월∼7년6개월
326026,판례내용,125,"2.양형기준에 따른 권고형의 범위: 미수범이므로, 양형기준이 적용되지 않는다."
326026,판례내용,126,"3.선고형의 결정: 징역 1년, 실형 이 사건 범행은 피고인이 함께 공공근로를 하는 피해자의 집에 가게된 것을 기화로 대낮에 만 88세인 피해자의 옷을 강제로 벗기고 추행을 한 후 강간을 하려다가 미수에 그친 사안으로 피고인과 피해자의 관계, 피해자의 나이 등에 비추어, 죄질이 좋지 않다."
326026,판례내용,127,"이 사건 범행으로 피해자는 상당한 정신적 충격과 성적 수치심을 받은 것으로 보이는데, 피고인은 피해자로부터 용서받거나 합의에 이르지 못하였다."
326026,판례내용,128,피고인은 수사 이후 줄곧 피해자의 적극적인 권유로 성관계를 시도하게 된 것이라는 납득하기 어려운 변명으로 일관하고 있어 범행 후의 정황도 좋지 않다.
326026,판례내용,129,"다만, 피고인 역시 68세로 고령이다."
326026,판례내용,130,"이 사건 범행 전 도로교통법위반(사고후미조치)죄로 벌금 300,000원을 선고받은 것 외 다른 범죄전력이 전혀 없다."
326026,판례내용,131,이 사건 범행이 미수에 그친 점 등 피고인에게 유리한 정상이 있다.
326026,판례내용,132,"위 사정들과 피고인의 성행, 지능과 환경, 이 사건 범행의 동기와 경위, 수단과 결과, 가족관계 등 제반 양형조건을 종합하여 주문과 같이 형을 정한다."
326026,판례내용,133,"신상정보 등록 및 제출 의무 판시 범죄사실에 대하여 유죄판결이 확정되는 경우 피고인은 성폭력범죄의 처벌 등에 관한 특례법 제42조 제1항에 의하여 신상정보 등록대상자에 해당하게 되므로, 같은 법 제43조에 따라 관할기관에 신상정보를 제출할 의무가 있다."
326026,판례내용,134,재판장 판사 나○
326026,판례내용,135,_________________________
326026,판례내용,136,판사 손○
326026,판례내용,137,_________________________
326026,판례내용,138,판사 강○
326026,판례내용,139,_________________________
