판례일련번호,구분,문장번호,내용
304097,판례내용,80,"그러나 앞서 본 사실에 의하면, 경찰은 이 사건 사기그릇의 하단에서 2점의 지문을, 위쪽 및 안쪽에서 각 1점씩의 지문을 각 채취하였는데,위 4개의 지문은 처음에는 누구의 지문인지 모두 판명되지 않았다가, 이후 2013년의재감정결과 이 사건 사기그릇 안쪽 면에서 채취한 지문 1점이 피고인의 지문으로 판명되었음을 알 수 있는바 그렇다면 이 , 사건 사기그릇에는 아직 누구의 것인지 판명되지아니 한 지문 3개가 존재한다고 할 것이므로, 이 사건 사기그릇에 피해자의 지문이 없다고 단정할 수 없다."
304097,판례내용,81,따라서 피고인 및 변호인의 위 주장 역시 받아들이기 어렵다.
304097,판례내용,82,7)소결론
304097,판례내용,83,"피해자의 범인과 관련된 진술은 신빙성이 없고, 심지어 피해자가 묘사하는 범인의 모습이 피고인의 실제 모습과 다른 점이 많아 피고인이 실제 범인인지가 의심스럽기도 하다."
304097,판례내용,84,"그러나 피해자의 범행과 관련된 진술은 그 신빙성이 매우 높다는 점, 범인의 것이라고 보지 않을 수 없는 지문이 이 사건 사기그릇에서 나왔고, 그 지문이 피고인의것이라는 객관적이고도 과학적인 증거가 존재하며 위 지문에 관한 피고인의 변소에 설득력이 없다는 점, 피고인의 검찰에서의 자백 또한 신빙성이 있다는 점, 피고인이 범행현장에 없었다는 주장도 받아들이기 어렵다는 점 등을 모두 고려하여 보면, 비록 원심이 피해자의 범인과 관련된 진술에 신빙성을 부여한 것은 잘못이지만, 나머지 원심이적법하게 채택한 증거들에 의하더라도 이 사건 공소사실을 유죄로 인정하기에 충분하므로, 원심판결에 채증법칙 위배의 잘못으로 인해 사실을 오인한 잘못을 범하였다고 볼수는 없다."
304097,판례내용,85,"따라서, 피고인의 사실오인에 관한 주장은 이유 없다."
304097,판례내용,86,"피고인이 초범이고 지금까지 비교적 성실하게 살아 온 점, 피고인의 직장동료 등이선처를 호소하는 탄원서를 제출할 정도로 사회적 유대관계가 분명하다고 보이는 점 등은 피고인에게 유리한 정상이다."
304097,판례내용,87,"그러나 이 사건 범행은 심야에 , 피해자의 집에 침입한 후 흉기인 칼로 3시간 가까이피해자를 위협하면서 강간을 하고 피해자로 하여금 유사성행위를 하게 한 것으로, 이러한 범행 경위․수법․내용 등에 비추어 그 죄질이 매우 무겁다는 점, 피해자와 합의되지 않았고, 피해자가 피고인의 처벌을 강력히 원하고 있는 점, 그 밖에 피고인의 나이, 성행, 환경, 범행의 동기 및 수단과 결과, 범행 후의 정황 등 이 사건에 나타난 모든 양형조건들과 대법원 양형위원회의 양형기준 적용결과1)를 종합하여 보면, 피고인이내세우는 정상들을 감안하더라도 원심의 선고형이 피고인의 책임정도에 비하여 너무무거워서 부당하다고 볼 수 없다."
304097,판례내용,88,"따라서, 피고인의 양형부당 주장 역시 이유 없다."
304097,판례내용,89,"그렇다면, 피고인의 항소는 이유 없으므로 형사소송법 제364조 제4항에 따라 이를기각하기로 하여 주문과 같이 판결한다."
304097,판례내용,90,"[다만, 원심판결의「법령의 적용」‘1.공개명령’에 기재한 “성폭력범죄의 처벌 등에 관한 특례법 제47조 제1항, 아동․청소년의 성보호에 관한 법률 제49조 제1항, 제2호, 제3항”은 “구 성폭력범죄의 처벌 등에 관한 특례법(2012.12.18."
304097,판례내용,91,"법률 제11556호로 개정되기 전의 것)제37조 제1항”의 오기이고,‘1.고지명령’의 “성폭력범죄의 처벌 등에 관한 특례법 제49조 제1항, 아동․청소년의성보호에 관한 법률 제50조 제1항 제2호 제4항”은 “구 성폭력범죄의 처벌 등에 관한특례법 법률 (2012.1.17."
304097,판례내용,92,"제11162호로 개정되기 전의 것)제41조 제1항”의 오기이며,「신상정보 등록」중 ”성폭력범죄의 처벌 등에 관한 특례법 제42조“는 ”구 성폭력범죄의 처벌 등에 관한 특례법(2012.12.18."
304097,판례내용,93,"법률 제11556호로 전부 개정되기 전의 것)제32조 제1항“의 오기이고, ”같은 법 제43조“는 ”성폭력범죄의 처벌 등에 관한 특례법제43조“의 오기임이 명백하므로, 형사소송규칙 제25조에 의하여 이를 각 경정한다.]"
304097,판례내용,94,재판장 판사 이○ _________________________
304097,판례내용,95,판사 이○ _________________________
304097,판례내용,96,판사 이○ _________________________
