판례일련번호,구분,문장번호,내용
325400,판례내용,137,"2)피해자와 C의 진술을 종합하면, 피고인과 C은 2021.3.경부터 2022.3.경까지 1년 정도 동거하였고, 그 기간 동안 피고인은 여러 차례 피해자를 추행한 것으로 보인다."
325400,판례내용,138,"그러나 피해자의 인지, 기억, 표현의 한계로 인하여 피해 시점을 특정하기 어렵기 때문에, 검사는 C의 신고 시점에 가까운 2회의 강제추행 범행만을 특정하여 기소한 것으로 보인다."
325400,판례내용,139,이러한 기소의 경위도 피고인에게 불리한 정상이다.
325400,판례내용,140,3)이 사건 각 범행에 대한 법정형은 5년 이상의 유기징역이다.
325400,판례내용,141,"원심 및 당심이 판시한 피고인에게 불리한 여러 정상을 감안하면, 피고인에게 동종 성폭력범죄 전력이 없다는 사정이 정상참작 감경을 할 만한 충분한 사정인지 의문이다."
325400,판례내용,142,"변호인은 2023.9.13.자 변호인 의견서에서, 피고인보다 죄질이 훨씬 무거운 사안에서 이 사건 원심판결보다 가벼운 형이 선고된 사례가 많다는 주장을 하였다."
325400,판례내용,143,"그러나 변호인이 제출한 판결례만을 살펴보더라도, 피고인이 범행을 인정하고 진지하게 반성하는 사안, 피해자와 합의하고 용서를 받은 사안, 피해자가 아동․청소년 중 나이가 많은 편인 사안, 피고인이 소년일 때 범행한 사안 등 이 사건과는 사안이 전혀 다른 판결례들로 보인다."
325400,판례내용,144,"이 사건은 앞서 본 것처럼, 정상참작 감경을 하는 게 적절한지 의문이고, 양형기준에 따른 권고형의 최하한을 선고형으로 정하였으며, 당심에서 원심의 형을 감경할 만한 유리한 양형 조건이 발생한 바 없는 반면, 당심에서 피고인이 C을 무고와 모해위증 등 혐의로 고소하는 등 불리한 양형 조건만 발생하였으므로, 원심의 형을 감경할 여지가 없다."
325400,판례내용,145,4.결론
325400,판례내용,146,그렇다면 피고인의 항소는 이유 없으므로 형사소송법 제364조 제4항에 따라 이를 기각한다.
325400,판례내용,147,재판장 판사 송○ _________________________
325400,판례내용,148,판사 이○ _________________________
325400,판례내용,149,판사 김○ _________________________
