판례일련번호,구분,문장번호,내용
330254,판례내용,77,"결국 이 사건 각 건물과 같은 주거용 건물의 임대차계약에서, 임차인으로서는 해당 건물의 가액에서 우선변제권이 인정되는 선순위 근저당권과 선순위 임차인의 채권액을 공제한 금액이 자신의 임대차보증금에 미치지 못한다면, 임대차기간이 만료하더라도 임대차보증금을 반환받거나 회수하지 못할 위험이 있으므로 임대차계약을 체결하지 않을 것임이 거래의 경험칙상 명백하다고 할 것이고, 임대인이 선순위 임차인의 누적 임대차보증금 액수를 의도적으로 고지하지 않거나 사실과 다르게 고지하여 임차인으로 하여금 해당 건물의 잔존 담보가치에 관하여 착오에 빠지게 함으로써 임대차계약의 체결에 이르게 하였다면, 그 자체로 사기죄에서의 기망행위에 해당한다고 할 것이다."
330254,판례내용,78,나)판단기준과 ⑤주장에 대한 판단 (1)위와 같이 이 사건 각 임대차계약 체결 당시 해당 건물의 잔존 담보에 관한 피고인의 기망행위가 있었는지 여부를 판단함에 있어서는 피고인이 임차인에게 고지해야 할 해당 건물의 잔존 담보가치 또는 우선변제권 있는 선순위 채권의 액수가 얼마인지 확정할 필요가 있다.
330254,판례내용,79,"그 중 선순위 근저당권에 대하여 원심 법원은, 장래의 증감변동하는 불특정의 채권은 근저당권의 채권최고액 한도 내에서 담보된다는 근저당권의 성격, 저당권의 피담보채권에는 원금뿐만 아니라 이자, 연체이자 등도 포함된다는 점 등에 비추어 선순위 근저당권의 채권최고액을 기준으로 판단하는 것이 타당하다고 보았다."
330254,판례내용,80,"원심이 판시한 이유 및 ① 위 가)항에서 살펴본 것과 같이 이 사건에서 쟁점이 되는 피고인의 기망행위의 내용은 거래의 경험칙상 임차인이 임대차계약 체결 과정에서 중요하고 핵심적으로 고려하는 해당 건물의 잔존 담보가치에 관하여 기망하였다는 것이고, 임차인으로서는 해당 건물에 선순위 근저당권이 설정되어 있는 경우 당연히 근저당권의 채권최고액 상한까지 우선변제권이 미칠 수 있다는 전제에서 그 잔존 담보가치를 예상할 수밖에 없는 점, ② 경험칙상 임차인이 해당 건물에 관하여 임대인으로부터 고지받은 선순위 임대차보증금과 선순위 근저당권의 채권최고액 합산액이 해당 건물의 가액에 근접하거나 초과하는 경우 설령 근저당권의 실제 피담보채무액이 채권최고액보다 낮다고 하더라도 위험을 무릅쓰고 임대차계약을 체결할 것으로 보이지는 않는 점 등을 종합하여 보면, 피고인이 임차인에게 고지해야 할 해당 건물의 잔존 담보가치를 확정함에 있어서는 선순위 근저당권의 실제 피담보채무액이 아니라 그 채권최고액을 기준으로 삼는 것이 타당하므로, 원심의 위와 같은 판단은 정당하다고 할 것이다."
330254,판례내용,81,"(2)원심은 피고인이 임차인에게 고지해야 할 해당 건물의 잔존 담보가치를 산정하기 위한 해당 건물 및 부지의 이 사건 각 임대차계약 당시 가액은, 이 사건 각 임대차계약 체결 이후 이 사건 각 건물 및 부지에 대하여 개시된 각 경매절차에서 2019.5.경부터 같은 해 11.경 사이에 실시된 감정평가결과에 따른 가액 또는 실제 매각대금이 위 감정평가액보다 높은 경우에는 그 매각대금 상당액이라고 판단하였다."
330254,판례내용,82,"원심 및 당심이 적법하게 채택하여 조사한 증거들에 의하여 인정할 수 있는 다음과 같은 사정들, 즉 ① 위 각 경매절차에서의 각 감정평가는 ｢감정평가에 관한 규칙｣ 등에 따른 감정평가방식 중 원가방식 및 비교방식(거래사례비교법)에 따라 이루어졌고, 그 감정평가에 오류가 있음을 인정할 자료가 없는 점, ② 이 사건 각 임대차계약이 체결된 시점과 위 각 감정평가가 실시된 시점을 감안하면, 이 사건 각 임대차계약 당시의 감정평가결과가 위 각 경매절차에서의 감정평가결과보다 더 높았을 것으로 보이지 않는 점, ③ 원심에서 증인으로 출석한 중개인들은 이 사건 각 임대차계약 당시 이 사건 각 건물의 시세가 위 각 감정평가결과보다 높았을 것이라는 취지로 진술하였고, 피고인 및 변호인은 항소심에서 주변 지역의 거래사례들을 증거로 제출하였으나, 이 사건 각 건물은 피고인과 그 친인척 명의로 신축된 후 실제 매매거래가 이루어진 사례가 전혀 없었고, 위 중개인들의 진술은 주변 지역 다른 건물의 거래가격을 참고로 이 사건 각 건물의 시세를 추측한 것에 지나지 않으며, 부동산의 시세는 입지조건, 건물의 구조와 이용현황, 토지이용계획 및 제한상태, 위법건축물의 존재 여부 등 여러 요소의 영향을 받으므로 주변 지역 다른 건물의 거래사례들이 이 사건 각 임대차계약 당시 건물과 부지의 가액을 알 수 있는 객관적인 자료라고 보기는 어려운 점 등에 비추어 보면, 원심의 위와 같은 판단은 정당하다."
330254,판례내용,83,(3)따라서 피고인 및 변호인의 ⑤주장은 받아들이지 아니한다.
330254,판례내용,84,"3)④주장에 대한 판단 피고인 및 변호인은 원심에서도 이 부분 항소이유와 동일한 주장을 하였고, 이에 대하여 원심 법원은 위 2.가.1)의 (아)항에서와 같은 이유로 위 주장을 배척하였다."
330254,판례내용,85,"원심이 판시한 이유들에다가 원심 및 당심이 적법하게 채택하여 조사한 증거들에 의하여 인정할 수 있는 다음과 같은 사정들, 즉 ① 앞서 살펴본 바와 같이 거래의 경험칙상 주거용 건물의 임차인이 임대차보증금의 회수 가능성을 판단함에 있어 해당 건물의 담보가치 외에 임대인의 다른 일반재산은 중요한 고려대상이 아니고, 따라서 피고인이 임대차 목적물인 해당 건물에 관하여 선순위 임차인의 누적 임대차보증금 액수를 사실과 다르게 고지하였다면 그 자체로 사기죄에서의 기망행위에 해당하는 점, ② 피고인이 2017년경부터 2019년경까지 사이에 피고인과 친인척들, 피고인이 지분을 보유한 회사 등의 명의로 이 사건 각 건물 외 여러 개의 건물과 토지를 보유하고 있었기는 하나, 피고인은 이 사건 각 건물의 임차인으로부터 지급받은 임대차보증금과 신규 대출금을 이용하여 추가로 토지를 매입하고 건물을 신축하는 방법으로 사업을 계속 크게 확장시켜왔고, 이 사건 각 건물 외의 다른 일반 재산들 대부분이 위와 같은 사업 확장 과정에서 취득한 부동산인 것으로 보이며, 사업 확장 과정에서 신규 사업에 투자한 임대차보증금을 곧바로 회수하거나 그 과정에서 취득한 부동산을 용이하게 환가하기도 매우 곤란한 상황이었으므로, 새로운 임차인으로부터 지급받는 임대차보증금으로 기존 임차인에게 임대차보증금을 반환하는 방법 외에 위와 같은 일반 재산을 통해서 임대차기간이 만료한 임차인들에게 임대차보증금을 제때 반환할 수 없었던 것으로 보이는 점 등을 더하여 살펴보면, 원심의 판단은 정당한 것으로 수긍할 수 있다."
330254,판례내용,86,따라서 피고인 및 변호인의 ④주장도 받아들이지 아니한다.
330254,판례내용,87,"4)①, ② 각 주장에 대한 판단 가)아래 나)항 기재 피해자들을 제외한 부분 피고인 및 변호인은 원심에서도 이 부분 항소이유와 동일한 주장을 하였고, 원심 법원은 앞서 위 2.가.2)항에서 본 판단기준을 기초로 원심판결의 ‘피고인과 변호인의 주장에 대한 판단’ 부분 제2.나.2)항에서 피고인이 이 사건 각 임대차계약 체결 당시 이 사건 각 건물의 선순위 임대차보증금 합산액을 부동산중개인을 통하여 제대로 고지하지 않아 피해자들을 기망하였다고 인정하고, 피고인 및 변호인의 주장을 배척하였다."
330254,판례내용,88,"아래 나)항에서 살펴보는 부분을 제외하고는, 원심이 판시한 사정들을 기록과 대조하여 면밀히 살펴보고, 이에 원심 및 당심이 적법하게 채택하여 조사한 증거들에 의하여 인정할 수 있는 다음과 같은 사정들, 즉 ㉮ 원심이 인정한 이 사건 각 임대차계약 체결 당시 선순위 임대차보증금의 누적액수는 위 각 임대차계약 체결 이후 2019년경 개시된 각 경매절차에서 배당신청을 한 임차인들의 임대차보증금을 근거로 산정한 것인데, 위 각 임대차계약 체결 당시에는 선순위 임차인이었다가 위 각 경매절차가 개시되기 전에 임대차보증금을 반환받은 임차인이나 위 각 경매절차에 배당신청을 하지 않은 임차인 등 경매절차에 참여하지 않은 선순위 임차인이 다수 존재할 수 있으므로, 원심이 인정한 선순위 임대차보증금 누적액은 피고인이 이 사건 각 임대차계약 체결 당시 피해자들에게 고지하였어야 할 선순위 임대차보증금 누적액의 최소 금액임이 분명한 점, ㉯ 원심 법정에 증인으로 출석한 중개인들은 이 사건 각 임대차계약 체결 당시 피해자들에게 피고인 또는 임대인의 재력을 직접적으로 과시하는 말을 하지 않았다는 취지로 일치하여 진술하였고, 중개인이 부동산등기부를 통해 공시된 선순위 근저당권의 채권최고액을 기초로 예상되는 대출금의 액수를 나름대로 추측하여 피해자들에게 설명하였을 수는 있으나, 선순위 임대차보증금의 누적액은 피고인의 관여와 설명 없이는 중개인 스스로 확인할 수 있는 방법이 전혀 없었던 점 등을 더하여 보면, 원심의 위와 같은 판단은 정당한 것으로 수긍할 수 있고, 거기에 ①, ② 각 주장과 같은 사실오인의 잘못은 없다고 할 것이다."
330254,판례내용,89,"나)피해자 FB, FA, OF, OX, SE, TC, TV에 대한 각 사기의 점을 유죄로 인정한 부분 위 피해자들에 대한 각 사기의 점을 유죄로 인정한 원심의 판단은 다음과 같은 이유에서 이를 수긍할 수 없다."
330254,판례내용,90,"(1)피해자 FB, FA에 대한 각 사기의 점에 관하여 살피건대, 원심이 적법하게 채택하여 조사한 증거들에 의하면, 위 피해자들이 임차한 AH는 2017.6.8."
330254,판례내용,91,"소유권보존등기가 마쳐진 사실, 피해자 FB, FA보다 먼저 AH에 관한 임대차계약을 체결한 임차인이 다수 존재하였으나, 위 피해자들이 각 임대차계약을 체결할 당시까지 AH에 대한 준공검사 및 소유권보존등기가 마쳐지지 않아 위 피해자들보다 먼저 임대차계약을 체결한 임차인들이 우선변제권을 확보하는 데 필요한 확정일자를 받지 못한 사실, 피해자 FA은 중개인으로부터 위와 같은 이유로 임차인들 사이의 우선변제권 순위를 알 수 없다는 설명을 듣기도 한 사실을 각 인정할 수 있다."
330254,판례내용,92,"(2)위 인정사실에 비추어 보면, 비록 피해자 FB, FA이 AH에 관하여 각 임대차계약을 체결할 당시 위 피해자들보다 앞서 임대차계약을 체결한 임차인들의 임대차보증금 합계가 AH의 가액에서 선순위 근저당권의 채권최고액을 공제한 잔존 담보가치에 근접하였거나 이미 초과하였다고 하더라도, AH에 관한 준공검사와 소유권보존등기가 마쳐진 이후 그 때까지 임대차계약을 체결한 임차인들이 동시다발적으로 전입신고를 하고 확정일자를 부여받는 상황이 발생할 수밖에 없는바, 사정이 그와 같다면 피고인으로서도 위 피해자들과 임대차계약을 체결할 당시에는 임차인들 사이의 우선변제권의 선후관계를 파악할 수는 없었고, 이는 위 피해자들의 입장에서도 충분히 예측 가능한 것이었다고 봄이 상당하다."
330254,판례내용,93,"따라서 피고인이 중개인을 통하여 위 피해자들에게 선순위 임대차보증금을 고지하지 않았다거나 사실과 다르게 고지하였다고 하더라도 AH의 잔존 담보가치에 관하여 위 피해자들을 기망하였다고 인정하기는 어렵고, 달리 이를 인정할 증거가 없다."
330254,판례내용,94,"(3)피해자 OF, OX, SE, TC, TV에 대한 각 사기의 점에 관하여 살피건대, 원심이 적법하게 채택하여 조사한 증거들에 의하면, 피해자 OF의 임대차계약 체결 당시 U DN동의 선순위 임대차보증금의 누적액은 809,000,000원이고, 중개대상물 확인설명서에는 그 누적액이 약 10억 원으로 기재되어 있는 사실, 피해자 OX의 임대차계약 체결 당시 U DG동의 선순위 임대차보증금의 누적액은 923,000,000원이고, 중개대상물 확인설명서에는 그 누적액이 약 9억 원으로 기재되어 있는 사실, 피해자 SE의 임대차계약 체결 당시 U X동의 선순위 임대차보증금 누적액은 770,000,000원이고, 중개대상물 확인설명서에는 그 누적액이 7억 5,000만 원으로 기재되어 있는 사실, 피해자 TC의 임대차계약 체결 당시 U DA동의 선순위 임대차보증금의 누적액은 848,000,000원이고, 중개대상물 확인설명서에는 그 누적액이 약 10억 5,000만 원으로 기재되어 있는 사실, 피해자 TV의 임대차계약 체결 당시 U DR동의 선순위 임대차보증금의 누적액은 975,000,000원이고, 중개대상물 확인설명서에는 그 누적액이 약 10억 원으로 기재되어 있는 사실을 각 인정할 수 있다.위 인정사실에 비추어 보면, 피고인이 중개인들을 통하여 위 피해자들에게 고지한 선순위 임대차보증금의 누적액은 실제 누적액에 근접하거나 이를 초과하고 있는바, 피고인이 위 피해자들에게 선순위 임대차보증금의 누적액을 허위로 고지함으로써 해당 건물의 담보가치를 기망하였다거나 피고인에게 그와 같은 기망의 고의가 있었다고 인정하기는 어렵고, 달리 이를 인정할 증거가 없다."
330254,판례내용,95,"(4)따라서 이 사건 공소사실 중 피해자 FB, FA, OF, OX, SE, TC, TV에 대한 각 사기의 점은 범죄의 증명이 없는 경우에 해당한다고 할 것이고, 그럼에도 이 부분 공소사실을 유죄로 인정한 원심판결에는 사실을 오인하여 판결에 영향을 미친 잘못이 있다."
330254,판례내용,96,"5)③주장에 대한 판단 피고인 및 변호인은 원심에서도 이 부분 항소이유와 동일한 취지의 주장을 하였고, 원심은 원심판결의 ‘피고인과 변호인의 주장에 대한 판단’ 부분 제2.나.3)항에서 그 판시와 같은 이유로 위 주장을 배척하고 피고인의 임대차보증금 편취의 고의를 인정하였는바, 원심이 판시한 사정들에다가 원심 및 당심이 적법하게 채택하여 조사한 증거들에 의하여 알 수 있는 다음과 같은 사정들을 종합하여 보면, 원심의 판단은 정당한 것으로 수긍할 수 있고, 거기에 위 항소이유 주장과 같은 사실오인의 잘못은 없다."
330254,판례내용,97,"가)피고인 및 변호인은 임대차기간 만료 무렵에 임대차보증금을 반환할 자력이 생기거나 그럴 가능성이 있다면 임대차계약 당시 편취 범의가 있었다고 볼 수 없다는 주장을 하고 있으나, 사기죄의 성립 여부는 그 행위 당시를 기준으로 판단하여야 하므로, 피고인의 기망행위 여부 및 편취 범의 또한 이 사건 각 임대차계약 체결 당시를 기준으로 판단해야 하므로, 피고인 및 변호인의 위 주장은 받아들일 수 없다."
330254,판례내용,98,"나)피고인이 주장하는 것과 같이 2018.12.경까지는 이 사건 각 건물에 관한 임대차보증금반환이 대체로 이루어진 것으로 보이지만, 앞서 살펴본 바에 의하면 이는 피고인이 중개인을 통하여 임차인들에게 선순위 임대차보증금 누적액을 제대로 고지하지 않음으로써 새로운 임차인들이 지속적으로 유입되었기 때문인 것으로 보인다."
330254,판례내용,99,"또한 원심에서 증인으로 출석한 일부 중개인들이 2019.1.경 무렵 동탄2신도시에 저렴한 전세 매물이 다량 공급되고 이 사건 각 건물을 임차하려는 수요가 예전에 비해 다소 감소하였다는 취지의 증언을 하였으나, 부동산 시장의 공급과 수요는 그 시장의 환경 변화에 따라 얼마든지 증감할 수 있는 것이고, 20여 개 이상의 건물을 보유하면서 부동산 임대업을 하는 피고인으로서는 이러한 공급과 수요 변화의 가능성을 충분히 예견할 수 있었다고 보아야 하므로, 2018.12.경까지 이 사건 각 건물에 관한 임대차보증금반환이 잘 이루어졌고 2019.1.경 무렵 이 사건 각 건물에 대한 수요가 다소 감소하였다는 사정은 이 사건 각 임대차계약 체결 당시 피고인의 편취 범의를 부인하는 근거가 될 수 없다."
330254,판례내용,100,"한편, 피고인은 2017년경 무렵부터 AE과 동업하여 부동산개발사업을 추진하였는데, 이 사건 각 임대차계약 체결에 따라 지급받은 임대차보증금 대부분을 위 사업을 위한 초기 사업자금으로 투자하거나 임대차기간이 만료한 기존 임차인에게 임대차보증금을 반환하는 용도로 사용하였고, 위 임대차보증금 외에는 별다른 수입원이 없었으므로, 새로운 임차인과 임대차계약을 체결하지 못하는 경우에는 종전 임차인에게 임대차보증금을 제때에 반환할 수 없는 상황에 처해 있었다고 판단된다."
330254,판례내용,101,피고인은 임차인으로부터 지급받은 임대차보증금 대부분을 위와 같은 용도로 사용하면서 임대차기간이 만료하는 임차인들에게 임대차보증금을 제때에 반환하기 위한 최소한의 자금이나 적절한 자금 확보수단을 마련하지 않은 채 거액의 자금을 새로운 부동산개발사업에 투자한 것으로 보인다.
330254,판례내용,102,"이에 비추어 보면, 피고인이 AE과 동업하여 추진한 사업이 2019.1.경 무렵 어려워진 사정이 있다고 하더라도, 피고인이 이 사건 각 임대차계약 체결 당시 임대차보증금반환과 관련하여 전혀 예상할 수 없었던 후발적인 사정변화라고 보기는 어렵다."
330254,판례내용,103,나.원심판결의 유죄 부분 중 각 업무방해죄 및 명예훼손죄에 관한 주장에 대한 판단 1)이 부분 공소사실에서 피고인이 피해자 AG(이하 나.항에서 ‘피해자’라고만 한다)에 관하여 유포하거나 적시한 허위사실의 내용은 ‘피해자가 AE과 공모하여 AH 건물의 총 37개 호실(이하 이를 통틀어 ’이 사건 AH’라고 한다)에 관하여 2019.8.22.
330254,판례내용,104,"통정허위매매를 하였고, 피해자는 AE의 사기 및 강제집행면탈 범행에 공모하였다‘는 것이므로, 위 내용이 허위사실인지 여부에 관하여 살펴본다."
330254,판례내용,105,"2)원심 및 당심이 적법하게 채택하여 조사한 증거들에 의하여 인정할 수 있는 다음과 같은 사정들을 종합하여 보면, 피고인이 유포하거나 적시한 위 사실이 허위라고 판단하여 이 부분 공소사실을 유죄로 인정한 원심판결은 정당하고, 거기에 피고인 및 변호인이 주장하는 것과 같은 사실오인의 잘못은 없다."
330254,판례내용,106,가)AE과 피해자가 2019.7.10.
330254,판례내용,107,"작성한 대물변제합의서에는, AE이 피해자에 대하여 합계 1,662,780,000원의 차용금 및 이에 대한 이자 지급채무를 부담하고 있고, 위 채무를 변제하기 위하여 피해자가 이 사건 AH를 담보로 한 34억 원 상당의 대출금채무를 모두 승계 및 인수하는 조건으로 AE이 피해자에게 이 사건 AH를 양도한다고 기재되어 있다."
330254,판례내용,108,AE과 피해자는 위 대물변제합의서에서 이 사건 AH의 가액을 52억 원으로 합의하였다.
330254,판례내용,109,"나)아래의 사정들에 비추어 보면, 위 대물변제합의서에 기재된 피해자의 AE에 대한 대여금채권은 그 상당 부분이 실제 존재하는 채권이라고 할 것이므로, 피해자가 허위의 대여금채권을 근거로 AE과 이 사건 AH에 관하여 대물변제합의를 한 것은 아니라고 판단된다."
330254,판례내용,110,(1)위 대물변제합의서에는 차용금의 내역을 정리한 송금내역명세서가 첨부되어 있다.
330254,판례내용,111,"위 대물변제합의서에 기재된 차용금 합계액은 위 송금내역명세서상 합계 금액 1,663,780,000원보다 1,000,000원이 적은 금액이나, 이는 단순한 오기인 것으로 보인다."
330254,판례내용,112,"(2)피해자는 수사기관에 위 송금내역명세서를 뒷받침하는 J은행 및 DD은행 각 계좌의 금융거래내역을 제출하였고, 위 각 금융거래내역에서 확인되는 피해자의 AE에 대한 송금내역은 위 송금내역명세서상의 내역과 상당 부분 일치한다."
330254,판례내용,113,"(3)한편, 위 송금내역명세서 중 ① 2018.5.22.자 180,000,000원, ② 2017.10.19.자 140,000,000원, ③ 2018.2.9.자 100,000,000원은 피해자가 제출한 금융거래내역에서는 확인되지 아니하고, 위 송금내역명세서에는 ④ 현금으로 교부한 대여금 50,000,000원이 포함되어 있다."
330254,판례내용,114,"이에 대하여 피해자는 수사기관 및 원심 법정에서, ① 2018.5.22.자 180,000,000원은 피해자가 AE의 권유로 누나인 AAY, AAZ의 계좌를 통해 ABA 2차 시행사업에 180,000,000원을 투자한 후 AE과 사이에 이를 2017.5.22.자 대여금으로 합의하였고, 위 송금내역명세서에는 착오로 2018.5.22.로 기재한 것에 불과하며, ② 2017.10.19.자 140,000,000원은 같은 날 40,000,000원을 대여하였음에도 140,000,000원으로 잘못 기재한 것이고, 그 후 2019.8.28."
330254,판례내용,115,"AE이 지급해야 하는 이 사건 AH에 관한 가구대금 107,800,000원을 대신 지급함으로써 그 차액인 100,000,000원을 정산하였으며, ③ 2018.2.9.자 100,000,000원은 잘못 기재한 것이고, 추후 AE과 사이에 피해자의 누나들과 모친이 AE에게 투자한 돈을 정산하면서 함께 정산하기로 합의하였으며, ④ 현금 50,000,000원은 2017.7.경 AE을 소개해 준 ABB을 통해 현금으로 대여한 것이라는 취지로 진술하였다."
330254,판례내용,116,"피해자의 위 진술은 수사기관 및 원심 법정에서 일관되고, 위 180,000,000원에 관한 AAY, AAZ 명의의 각 금융거래내역, 2017.10.19.자 40,000,000원에 관한 금융거래내역과 피해자가 AE 대신 지급하였다는 가구대금의 금융거래내역, 현금 50,000,000원의 전달 과정에서 피해자가 AE에게 보낸 문자메시지 등에 의하여도 뒷받침되고 있으므로, 이를 신빙할 수 있다."
330254,판례내용,117,"(4)피해자의 위 J은행 계좌 금융거래내역에는 2017.12.6.자 총 200,000,000원, 2017.12.21.자 20,000,000원, 2018.1.10.자 총 200,000,000원, 2018.1.11.자 총 80,000,000원, 2018.2.14.자 총 100,000,000원, 2018.5.15.자 총 60,000,000원, 2018.12.3.자 130,000원, 2018.12.10.자 총 140,200,000원 합계 800,330,000원의 송금내역 각 적요란에 ’ABC’가 포함된 메모가 입력되어 있는데, ‘ABC’는 L 주식회사가 2017.12.6."
330254,판례내용,118,"매수계약을 체결한 ‘ABC 물류센터’ 부지를 지칭하는 것이며, L 주식회사는 피고인과 AE이 부동산개발사업을 하기 위하여 설립한 회사이고, 피해자도 2018.2.10.부 터 2019.8.6.까지 그 주식을 보유하였고 2019.3.4.부터 2019.10.10.까지 위 회사의 감사로도 등기되어 있었다."
330254,판례내용,119,"피고인은 피해자가 AE에게 위 합계 800,330,000원을 대여한 것이 아니라 L 주식회사의 주주로서 ‘ABC 물류센터’ 부지 매입비용을 투자한 돈이라고 주장한다."
330254,판례내용,120,그러나 피해자는 수사기관 및 원심 법정에서 일관하여 ‘위 금융거래내역상의 메모는 AE에게 수시로 돈을 대여하면서 그때마다 차용증을 작성하지 않는 대신 차용금의 명목을 기록해 두기 위하여 AE이 말한 차용금의 사용처를 입력해 둔 것이지 L 주식회사의 주주로서 위 돈을 부동산개발사업에 투자한 것이 아니다’는 취지로 진술하였다.
330254,판례내용,121,피해자는 2018.2.21.
