판례일련번호,구분,문장번호,내용
309835,판례내용,1,청 주 지 방 법 원
309835,판례내용,2,제 형 사 부
309835,판례내용,3,판 결
309835,판례내용,4,사 건 2019재노7 국가보안법위반
309835,판례내용,5,피 고 인 A
309835,판례내용,6,주거
309835,판례내용,7,등록기준지
309835,판례내용,8,"검 사 장○(기소), 신○(공판)"
309835,판례내용,9,"변○ 호 인 법무법인 이산 담당변○호사 이○, 변○호사 오○"
309835,판례내용,10,재심대상판결 청주지방법원 1990.1.25.
309835,판례내용,11,선고 89노563 판결
309835,판례내용,12,원 심 판 결 청주지방법원 제천지원 1989.10.7.
309835,판례내용,13,선고 89고단209 판결
309835,판례내용,14,판 결 선 고 2021.9.2.
309835,판례내용,15,주 문
309835,판례내용,16,원심판결을 파기한다.
309835,판례내용,17,피고인은 무죄.
309835,판례내용,18,이 판결의 요지를 공시한다.
309835,판례내용,19,이 유
309835,판례내용,20,이 사건의 경과
309835,판례내용,21,1.이 사건 기록에 의하면 아래와 같은 사실이 인정된다.
309835,판례내용,22,가.피고인은 청주지방법원 제천지원에 국가보안법위반으로 공소제기 되었다.
309835,판례내용,23,검사가 공소를 제기한 공소사실은 별지 공소사실 기재와 같고 그 요지는 아래와 같다.
309835,판례내용,24,나.위 법원은 이 사건 공소사실을 모두 유죄로 인정하고 피고인에 대하여 1989.10.7.
309835,판례내용,25,징역 년을 선고하였다.
309835,판례내용,26,청주지방법원 제천지원 고단호.
309835,판례내용,27,이에 대해 피고인은 1(89 209).
309835,판례내용,28,피고인은 충북 고등학교의 일본어 교사로 임용된 자로서 1989.3.1.
309835,판례내용,29,"B, 경 충북 고등학교 반 교실에서 등 학생 명을 상대로 일본어 수업 중 1.1989.4.11."
309835,판례내용,30,"11:30 B C D 52 수업 중은 당시 북한이 남침을 한 것이 아니고 미군이 먼저 북한을 침범하여 일어난 것이다라고 교육함으로써 반국가단체인 북한공산집단의 주장에 동조하고, 위 같은 달 경 같은 장소에서 위 등 학생 명을 상대로 일본어 수업 중 2.25.11:30 D 54 북한의 자연경관 평양시가 모습 김○ 동상 주체사상탑 북한 주민의 생활상 각종 산업활동 등의 칼라사진 장과 북에서는 누구나 원칙적으로 일 시간 주 일간 노동 59 1 8, 6 하고 교육과 의료는 국가가 부담하며 의식주도 국가로부터 제공되고 있어서 일생생활이 곤란하지 않다는 등의 설명이 수록된 민주통일민중운동연합 출판의 보고 싶은 산하라는 제목의 화보집을 학생들에게 보여주면서 여러분은 북한이 못사는 것으로 알고 있지만 사실은 잘 살고 있다."
309835,판례내용,31,북한 사람들은 사변 때 미국 공군의 극심한 폭격으로 폐허가 된 평양을 스스로의 힘으로 오늘날의 모습과 같이 재건한 사실에 대하여 커다란 자부심을 가지고 있다.
309835,판례내용,32,이 사진과 같이 북한 사람은 옷도 잘 입고 높은 건물도 많아 학생들이 생각하는 것만큼 나쁜 곳이 아니다.
309835,판례내용,33,북한은 평화롭고 살기 좋은 곳이다.
309835,판례내용,34,북한에도 주말에는 낚시를 할 수 있는 자유가 있다라는 등의 교육을 함으로써 반국가단체인 북한공산집단을 찬양 고무한 것이다.
309835,판례내용,35,"은 사실 오인 내지 법리 오해 및 양형 부당을 이유로 검사는 양형 부당을 이유로 각 항소하였고, 이 법원은 피고인의 사실 오인 및 법리 오해 주장을 배척한 다음, 1990.1.25."
309835,판례내용,36,피고인의 양형 부당 주장을 받아들여 원심판결을 파기하고 피고인에 대하여 징역 년에 집행유예 년 자격정지 년을 선고하였다.
309835,판례내용,37,"청주지방법원 노호 이하 이 법원의 2, 1(89 563, 판결을 재심대상판결이라 한다)."
309835,판례내용,38,다.피고인이 재심대상판결에 대하여 상고하였고 대법원은 피고인의 상고를 기각하여 재심대상판결이 그대로 확정되었다.
309835,판례내용,39,라.피고인은 이 사건 재심을 청구하였고 이 법원은 피고인이 경찰서 2019.5.28.
309835,판례내용,40,"E 대공과 소속 수사관들에게 불법 체포 및 감금된 상태에서 조사를 받은 사실을 인정하고, 수사관들의 위 행위는 인신구속에 관한 직무를 행하는 자가 그 직권을 남용하여 사람을 체포 또는 감금한 경우로서 형법 제124조에 정한 불법체포 감금죄에 해당하며, 수사관들이 피고인을 불법 체포 감금한 것은 1989.5.25.까지인데 형법 제124조에 정한 불법체포 감금죄는 그 법정형이 년 이하의 징역과 년 이하의 자격정지로서 구 형사소송법상 공소시효 기간이 년이므로 제5조 제4항 제1호 위 죄에 대한 공소시효가 완성되어 위 죄에 대하여는 유죄판결을 얻을 수 없는 사실상 법률상의 장애가 있는 경우에 해당하여 형사소송법 제420조 제7호 제422조에 정한 재심사유가 있다는 이유로 재심개시결정을 하였다."
309835,판례내용,41,2019.11.28.
309835,판례내용,42,마.위 재심결정은 항고기간의 도과로 그대로 확정되었다.
309835,판례내용,43,항소이유의 요지
309835,판례내용,44,2.가.피고인 및 변호인이 항소이유서 제출기간이 경과한 후 제출한 서면에 기재된 주장은 피고인의 이익을 위하여 기존의 항소이유에 포함된 내용을 구체적으로 밝히거나 이를 보충하는 취지로 선해하여 판단하기로 한다.
309835,판례내용,45,자 국가보안법위반의 점에 대한 사실오인
309835,판례내용,46,1)1989.4.11.
309835,판례내용,47,피고인은 이 부분 공소사실과 같이 수업시간에 학생들에게는 당시 북한이 “6.25 남침을 한 것이 아니고 미군이 먼저 북한을 침범하여 일어난 것이다”라고 말한 사실이 없다.
309835,판례내용,48,그럼에도 증거능력이 없거나 신빙성이 없는 증거들만으로 이 부분 공소사실을 유죄로 판단한 원심판결에는 사실을 오인하여 판결에 영향을 미친 위법이 있다.
309835,판례내용,49,자 국가보안법위반의 점에 대한 사실오인 및 법리오해
309835,판례내용,50,2)1989.4.25.
309835,판례내용,51,피고인은 수업시간에 학생들에게 북한의 사회 경제적인 현실을 바로 알게 설명하려는 목적으로 화보집에 실린 백두산 금강산 평양 시가지 평양 지하철 사진 등을 보여주면서 북한의 있는 그대로의 모습을 설명하였고 그 과정에서 김○ 동상 사진을 보여주면서 공산독재체제의 부정적인 측면에 대해서도 함께 설명한 사실이 있을 뿐 반국가단체인 북한을 찬양 고무하거나 기타의 방법으로 이롭게 하는 발언을 한 사실이 없다.
309835,판례내용,52,설령 피고인이 이 부분 공소사실과 같은 발언을 한 것이 사실이라고 하더라도 그와 같은 발언 행위만으로는 국가의 존립 안전을 위태롭게 하거나 자유민주적 기본 질서에 실질적 해악을 미칠 구체적이고 명백한 위험성이 없으므로 구 국가보안법 제7조 제1항 위반으로 처벌할 수 없다.
309835,판례내용,53,그럼에도 증거능력이 없거나 신빙성이 없는 증거들만으로 이 부분 공소사실을 유죄로 판단한 원심판결에는 사실을 오인하고 구 국가보안법 제7조 제1항의 적용에 관한 법리를 오해하여 판결에 영향을 미친 위법이 있다.
309835,판례내용,54,양형부당
309835,판례내용,55,3)원심이 피고인에 대하여 선고한 형 징역 년은 너무 무거워서 부당하다.
309835,판례내용,56,검사 양형부당 원심이 피고인에 대하여 선고한 형은 너무 가벼워서 부당하다.
309835,판례내용,57,판단
309835,판례내용,58,3.가.관련 법리
309835,판례내용,59,재심개시의 결정이 확정된 사건에 대하여는 법원은 그 심급에 따라 다시 심판을 하여야 하는데 형사소송법 제438조 제1항 여기에서 다시 심판한다는 것의 의미는 재심대상판결의 당부를 심사하는 것이 아니라 사건 자체를 처음부터 새로 심판하는 것을 의미하고 재심청구에 의한 심판절차에 있어서 원 확정판결의 소송절차에서 행하여진 증거조사의 결과가 당연히 증거로 되는 것은 아니다.
309835,판례내용,60,"따라서 재심개시 결정이 확정된 경우 법원은 재심개시 후 증거신청 증거결정 증거조사 등의 절차를 새로이 진행하여 증거능력을 구비하고 적법한 증거조사를 마친 것에 한하여 증거로 사용할 수 있고, 재심대상판결의 기초가 된 증거들 중 증거능력이 있는 증거들 및 그 이후에 수집된 증거들을 모두 종합하여 공소사실에 대한 판단을 하여야 한다."
309835,판례내용,61,대법원 선고(2004.9.24.
309835,판례내용,62,"도 판결 대법원 선고 도 판결 등 참조 2004 2154, 2015.2.12."
309835,판례내용,63,2014 9695).
309835,판례내용,64,재심이 개시된 사건에서 범죄사실에 대하여 적용하여야 할 법령은 재심판결 당시의 법령이고 재심대상판결 당시의 법령이 변경된 경우 법원은 재심판결 당시의 법령을 적용해야 하며 법령을 해석할 때도 재심판결 당시를 기준으로 해야 한다.
309835,판례내용,65,대법원 선고 도 판결 구 국가보안법은 법률 제1603호로 2011.10.27.
309835,판례내용,66,"개정되어 찬양고무죄의 구성요건에 국가의 존립안전이나 자유민주적 기본질서를 위태롭게 한다는 정을 알면서라는 요건이 모두 추가되었는데 이는 위 처벌규정이 문언의 다의성과 적용범위의 광범성으로 인하여 형사처벌이 확대될 위헌적 요소가 있으므로 국가의 존립안전을 위태롭게 하거나 자유민주적 기본질서에 위해를 줄 명백한 위험이 있을 경우만으로 축소하여 적용하는 것으로 해석하는 것이 헌법합치적 해석이라는 헌법재판소의 한정합헌 결정에 따른 것이며,"
309835,판례내용,67,이는 법률이념의 변경에 따라 법령을 개폐한 것이어서 형법 제1조 제2항에 따라 범죄 후 법률의 변경에 의하여 그 행위가 범죄를 구성하지 아니하는 경우에 해당한다고 봄이 타당하므로 결국 이 사건에 적용할 법령은 신법인 현행 국가보안법 제7조로 보아야 한다.
309835,판례내용,68,국가보안법이 적용되는 경우로서 국가의 존립안전과 자유민주적 기본질서에 실질적 해악을 끼칠 위험성이 있는 경우라 함은 국가의 존립안전과 자유민주적 기본질서에 명백하고도 현존하는 구체적인 위험을 발생시키는 경우에 한정한다.
309835,판례내용,69,대법원 선고 도 전원합의체 판결 참조(2008.4.17.
309835,판례내용,70,2003 758).
309835,판례내용,71,나.검사가 제출한 증거의 증거능력에 관한 판단
309835,판례내용,72,"검사가 제출한 증거 1)검사는 이 사건 공소사실을 입증하기 위하여 피고인에 대한 각 검찰 및 경찰 피의자신문조서, 검찰 및 경찰 수사단계에서 작성된 피고인의 각 진술서, 참고인 D, F, G, H, I, J에 대한 각 검찰 진술조서, 참고인 K, L, M, N, O, P, Q에 대한 각 경찰 진술조서, 경찰 수사단계에서 작성된 V, L, D, N, F, G, M에 대한 각 진술서, 각 압수물 및 압수조서, 감정서를 증거로 제출하였다."
309835,판례내용,73,2)피고인의 진술서 자 각 경찰 피의자신문조서 및 1989.5.24.
309835,판례내용,74,경찰 피의자신문조서의 증거능력 1989.5.25.
309835,판례내용,75,기록에 의하면 경찰서 대공과 소속 경감 외 명은 충북 고등학교 교장실에서 국가보안법위반 혐의에 관한 수사를 목적으로 피고인을 검거하고 경찰서로 연행하였고 피고인은 그로부터 구속영장 집행에 의하여 1989.5.25.
309835,판례내용,76,20:20 구금될 때까지 경찰서 유치장에 수감된 채 불법 구금 상태에서 진술서를 회 작성하고 회에 걸쳐 피의자신문을 받은 사실이 인정되는바 위와 같은 불법 체포 및 구금 중에 작성된 위 진술서 및 각 경찰 피의자신문조서는 헌법 제12조 제1항 제3항과 형사소송법 제200조의 규정한 체포 구속에 관한 영장주의 원칙에 위배하여 수집된 증거로서 형사소송법 제308조 제2항에 의하여 그 증거능력이 없다.
309835,판례내용,77,3)나머지 각 피의자신문조서 및 진술서의 증거능력 위 가항 기재 진술서 및 각 피의자신문조서를 제외한 나머지 각 피의자신문조서 및 진술서는 피고인이 원심에서 피고인에 대한 각 검찰 피의자신문조서에 대하여 그 진정성립 및 임의성을 인정하였고 피고인에 대한 각 경찰 피의자신문조서 및 피고인의 각 진술서에 대하여 성립의 진정 내용 및 임의성을 인정하였으므로 위 각 피의자신문조서 및 각 진술서는 증거능력이 인정된다.
309835,판례내용,78,"참고인 등에 대한 각 진술조서 및 각 진술서 위의 항 1)가 피고인이 원심에서 증거 동의한 진술증거 피고인은 원심에서 참고인 G, H, M, O, P, Q에 대한 각 경찰 진술조서 경찰 수사단계에서 작성된 진술서에 대해 증거로 함에 동의하였으므로 위 각 진술조서 및 진술서는 증거능력이 인정된다."
309835,판례내용,79,"나.D, F, I 중 일부로부터 피고인이 이 사건 북침발언을 말하였다는 것을 들었다는 부분을 제외한 나머지 부분에 대한 각 경찰 및 검찰 진술조서 중 일부 재전문진술 부분을 제외한 나머지 부분에 대한 각 검찰 진술조서에 대한 검찰 진술조서 중 일부전문진술 부분을 제외한 나머지 부분에 대한 경찰 진술조서 작성의 각 진술서 작성의 진술서 중 일부전문진술 부분을 제외한 나머지 부분 위 진술증거는 진술자들이 원심 법정에 출석하여 성립의 진정을 인정하였으므로 증거능력이 인정된다."
309835,판례내용,80,"이에 대해 피고인 및 변호인은 위 각 진술증거들은 경찰 등의 압박에 의하여 임의성이 없는 상태에서 작성된 것이어서 증거능력이 없다고 주장하나 기록상 진술자들이 임의성 없는 심리상태에서 위 각 진술증거들을 작성한 것이라고 의심할 만한 사정이 나타나 있지 않고 이 재심개시 후 당심이하 당심 D, F, G(‘F’이라 한다)법정에서 당시 허위의 내용을 진술하도록 강요받은 적은 없고 경험한 대로 진술하였다는 취지로 진술하였는바 위 진술증거의 각 진술자들의 진술에 임의성이 인정된다고 판단되므로 피고인 및 변호인의 위 주장은 받아들이지 아니한다."
309835,판례내용,81,"다.K, L, D, F, I 중 일부로부터 피고인이 이 사건 북침발언을 말하였다는 것을 들었다는 부분에 대한 각 경찰 및 검찰 진술조서 중 일부전문진술 부분에 대한 각 경찰 및 검찰 진술조서 작성의 진술서 중 일부전문진술 부분은 형사소송법 제310조의 규정에 의하여 원칙적으로 증거능력이 없고 형사소송법 제316조 제2항의 규정에 따라 원진술자가 사망 질병 외국거주 기타 사유로 인하여 진술할 수 없고 그 진술이 특히 신빙할 수 있는 상태 하에서 행하여진 때에 한하여 예외적으로 증거능력이 있다고 할 것이고 전문진술을 기재한 조서는 형사소송법 제312조 또는 제314조의 규정에 의하여 각 그 증거능력이 인정될 수 있는 경우에 해당하여야 함은 물론 나아가 형사소송법 제316조 제2항의 규정에 따른 위와 같은 요건을 갖추어야 예외적으로 증거능력이 있다고 할 것이다."
309835,판례내용,82,한편 형사소송법은 전문진술에 대하여 제310조에서 실질상 단순한 전문의 형태를 취하는 경우에 한하여 예외적으로 그 증거능력을 인정하는 규정을 두고 있을 뿐 재전문진술이나 재전문진술을 기재한 조서에 대하여는 달리 그 증거능력을 인정하는 규정을 두고 있지 아니하고 있으므로 피고인이 증거로 하는 데 동의하지 아니하는 한 형사소송법 제310조의 규정에 의하여 이를 증거로 할 수 없다.
309835,판례내용,83,대법원 선고 도(2004.11.12.
309835,판례내용,84,2004 4044 판결 등 참조).
309835,판례내용,85,살피건대 아래 증거는 피고인이 증거로 채택함에 부동의하였고 전문 진술 내지 재전문진술로 증거능력이 없다.
309835,판례내용,86,에 대한 각 경찰 및 검찰 진술조서 중 가 으로부터 피고인이 이 사건 북침발언을 말하는 것을 들었다고 전해 들었다는 부분은 전문진술로 원진술자인 이 원심 법정에 출석하여 진술하였으므로 형사소송법 제310조 제2항에 따라 증거능력이 없다.
309835,판례내용,87,에 대한 검찰 진술조서 중 이로부터 피고인이 이 사건 공소사실 기재와 같은 발언을 하였다는 것을 들었다고 전해 들었다는 부분은 전문진술로 원진술자인 이 원심 법정에 출석하여 진술하였으므로 형사소송법 제310조 제2항에 따라 증거능력이 없다.
309835,판례내용,88,에 대한 각 경찰 및 검찰 진술조서 중 이 및 로부터 이 피고인이 이 사건 공소사실 기재와 같은 발언을 하였다고 말한 것을 전해 들었다는 부분은 재전문진술을 기재한 조서로 형사소송법 제310조 제2항에 따라 증거능력이 없다.
309835,판례내용,89,"각 압수물 압수조서 및 감정서 위의 항 4), [1), ]㉢㉣ 기본적 인권 보장을 위하여 압수 수색에 관한 적법절차와 영장주의의 근간을 선언한 헌법과 이를 이어받아 실체적 진실 규명과 개인의 권리보호 이념을 조화롭게 실현할 수 있도록 압수 수색절차에 관한 구체적 기준을 마련하고 있는 형사소송법의 규범력은 확고히 유지되어야 하므로 헌법과 형사소송법이 정한 절차에 따르지 않고 수집한 증거는 물론이거니와 이를 기초로 하여 획득한 차적 증거 또한 기본적 인권 보장을 위해 마련된 적법한 절차에 따르지 않은 것으로서 원칙적으로 유죄 인정의 증거로 삼을 수 없다."
309835,판례내용,90,다만 수사기관의 절차 위반행위가 적법절차의 실질적인 내용을 침해하는 경우에 해당하지 아니하고 그 증거의 증거능력을 배제하는 것이 오히려 헌법과 형사소송법이 형사소송에 관한 절차 조항을 마련하여 적법절차의 원칙과 실체적 진실 규명의 조화를 도모하고 이를 통하여 형사사법 정의를 실현하려고 한 취지에 반하는 결과를 초래하는 것으로 평가되는 예외적인 경우에 한하여 그 증거를 유죄 인정의 증거로 사용할 수 있을 뿐이다.
309835,판례내용,91,대법원 선고 도 전원합의체 판결(2007.11.15.
309835,판례내용,92,2007 3061 결).
309835,판례내용,93,원심 및 당심에서 적법하게 채택하여 조사한 증거들에 의하여 인정되는 사실 및 사정들 즉 제천경찰서 대공과 소속 경감 경위 경사 경장은 1989.5.24.
309835,판례내용,94,고등학교 교장실에서 국가보안법위반 혐의에 관한 수사를 목적으로 피고인을 검거하고 경찰서로 연행하였고 피고인은 경찰서 대공과 조사실로 연행된 후 구속영장 집행에 의하여 구금될 때까지 모두 회에 걸쳐 1989.5.25.
309835,판례내용,95,"20:20 피의자신문을 받았으며 조사를 받지 않는 동안에는 경찰서 유치장에 수감되어 있었는바 피고인은 영장 없이 강제로 연행된 후 불법 구금 상태에서 조사를 받은 점, 각 압수조서에 의하면 경찰은 고등학교 교무실에 있는 피고인의 책상 및 피고인의 하숙집 방실에서 피고인이 소지 중인 서적 등을 피고인으로부터 임의로 제출 받아 압수하였고 피고인의 본가인 부의 집에서 피고인이 소지 중인 서적 등을 등으로부터 임의로 제출 받아 압수한 것으로 기재되어 있는데 이와 같은 압수 당시 피고인은 불법 체포 및 구금된 상태였던 점 위와 같은 압수와 관련하여 사전 또는 사후에 영장이 발부되지 않았던 점 등에 비추어 볼 때 해당 압수물은 임의제출 형식으로 수집되었지만 실질적으로는 불법 체포 및 구금 상태에서 수집된 증거이거나 영장주의 원칙을 위반하여 수집한 증거이고 각 압수조서도 위법하게 수집된 증거에 기초하여 획득된 차적 증거에 해당하여 증거능력이 없다."
309835,판례내용,96,따라서 피고인이 원심에서 한 증거 동의에도 불구하고 형사소송법 제308조 제2항의 의하여 그 증거능력을 인정할 수 없고 대법원 선고 도 판결 등 참조 위와 같이 증거능력이 없는 압수조서 및 압수물에 터 잡아 작성된 감정서도 증거능력이 없다.
309835,판례내용,97,소결론
309835,판례내용,98,"5)따라서 검사가 제출한 증거들 중 증거능력이 인정되는 증거는 피고인에 대한 각 검찰 피의자신문조서, 피고인에 대한 각 경찰 피의자신문조서, 각 경찰 피의자신문조서 및 각 검찰 진술조서에서 작성된 피고인의 각 진술서, D, F, H, N, G, J, M, O, P, Q에 대한 각 검찰 진술조서에 대한 각 경찰 및 검찰 진술조서 중 일부로부터 피고인이 이 사건 북침발언을 말하였다는 것을 들었다는 부분을 제외한 나머지 부분에 대한 각 경찰 및 검찰 진술조서 중 일부 재전문진술 부분을 제외한 나머지 부분에 대한 각 검찰 진술조서 및 작성의 진술서 중 일부전문진술 부분을 제외한 나머지 부분이다."
309835,판례내용,99,이하에서는 검사가 제출한 증거들 중 위와 같이 증거능력이 인정되는 증거들에 의해 이 사건 공소사실이 인정되는지를 살펴본다.
309835,판례내용,100,다.자 국가보안법위반의 점에 대한 사실오인 주장에 관한 판단
309835,판례내용,101,1989.4.11.
309835,판례내용,102,원심 및 당심이 적법하게 채택하여 조사한 증거들에 의하여 인정되는 아래와 같은 사실 및 사정들을 종합하여 보면 검사가 제출한 증거들만으로는 피고인이 이 부분 공소사실 기재와 같이 수업 중에 학생들에게 이 사건 북침발언을 하였다는 점을 인정하기에 부족하고 설령 피고인이 이 사건 북침발언을 말하였다고 하더라도 그러한 행위가 국가의 존립안전이나 자유민주적 기본질서를 위태롭게 할 위험이 있는 경우에 해당한다고 보기 어려우며 달리 이를 인정할 증거가 없다.
309835,판례내용,103,그럼에도 이 부분 공소사실을 유죄로 판단한 원심판결에는 사실을 오인하여 판결에 영향을 미친 위법이 있다.
309835,판례내용,104,피고인은 수사기관에서부터 당심에 이르기까지 일관되게 평소에도 북한이 대남 적화 전술에 의해 먼저 남침을 함으로써 일어난 것이라고 생각해 왔고 학생들에게 이 사건 북침발언을 한 사실이 전혀 없다라고 진술하였다.
309835,판례내용,105,"이 부분 공소사실에 부합하는 직접적인 증거는 이 사건 당시 교실에서 피고인의 수업을 들은 학생들인 D, F, H, N, G(‘D’라 한다)의 수사기관 및 원심 법정에서의 각 진술은 당심에서 당시 경험한 대로 진술하였다는 취지로 진술하고 있으나 아래와 같은 사정들에 비추어 보면 등은 자신들이 경험한 사실에 대해 착각하여 진술하였거나 스스로도 정확하게 기억하지 못하는 내용을 일부 교사 및 수사기관이 의도하는 바에 따라 과장하여 진술하였을 가능성을 배제하기 어려워 이를 그대로 믿기 어렵다."
309835,판례내용,106,"이 사건 당시 D의 담임교사인 L은 D에게 미리 행선지와 이유를 밝히지 않은 채 수사기관에 데려가 조사를 받게 하였고, D 등은 이 사건 당시 고등학교 2학년에 재학 중이던 학생들로서 아직 사고력과 분별력이 충분히 성숙하지 못한 상태에서 담임교사 및 경찰 등과 이 사건 공소사실과 관련하여 면담을 하면서 피고인에 대한 부정적인 설명을 듣는 과정을 거쳐 진술서를 작성하거나 수사기관에서 진술을 하였으며 작성의 각 진술서에는 작성일자도 기재되어 있지 않다."
309835,판례내용,107,"이후 원심 법정에서 D, F, N, G는 수사기관에서의 진술을 그대로 반복하였는바 위와 같은 사정들은 D, F, N, G의 진술의 신빙성을 의심할 만한 정황에 해당한다."
