판례일련번호,구분,문장번호,내용
309835,판례내용,108,D에 대한 경찰 및 검찰 진술조서 작성의 진술서 및 원심 법정진술에 관하여 살피건대 D는 진술서에서 피고인이 학생들에게 화보집에 실린 북한의 사진들을 보여주면서 설명을 하고 이 사건 북침발언을 하였다는 취지로 진술하였다가 수사기관에서 조사를 받으면서는 사진을 보여준 날과 이 사건 북침발언을 한 날은 서로 다른 날이라는 취지로 진술을 번복하였고 제회 경찰조사에서 이 사건 당시 학생들의 반응에 관하여 다른 사람은 모르겠으나 D에게 이북이 남한을 침범한 것으로 배웠는데 피고인이 미군이 먼저 이북을 침범했다고 하니 우리에게 전혀 다른 것을 가르치는 것 아니냐는 말을 하였다라고 진술하였으나 증거기록 제쪽 이 사건 당시 D는 결석한 상태였는바 증거기록 제쪽 이 사건 당시 피고인이 한 발언 내용을 정확하게 듣고 기억하여 수사기관 등에서 진술한 것이라고 단정하기 어렵다.
309835,판례내용,109,F에 대한 경찰 및 검찰 진술조서 작성의 진술서 및 원심 법정진술에 관하여 살피건대 F는 제회 경찰조사에서 틀림없이 피고인이 미군이 먼저 북침을 하여 6.25 사변이 일어난 것이라고 진술하였다가 증거기록 제쪽 피고인과의 대질조사에서는 당시 수업에 열중한 편은 아니고 다른 생각을 했던 것 같은데 이에게 지금 피고인이 미군이 북침을 했대라고 말하는 것을 들으니까 금방 일어선생이 한 말은 남침이 아니고 북침하여 일어난 것이라는 말을 한 것을 알게 된 것이다라는 취지로 진술하였으나 증거기록 제쪽 앞서 본 바와 같이 이 사건 당시 F는 결석한 상태였는바 F의 위 진술은 그대로 믿기 어렵다.
309835,판례내용,110,D 및 F는 수사기관에서부터 피고인이 이 사건 북침발언을 하였다는 진술만 반복하였을 뿐 구체적으로 피고인이 이 사건 북침발언을 하게 된 동기나 경위 전후 상황 및 발언의 맥락 등에 대해서는 아무런 기억이 나지 않고 피고인이 갑자기 그와 같은 말을 하였다는 취지로 진술하였는바 수업이 시작된 직후여서 교실이 소란스러웠고 D 및 F의 자리가 교실 뒤편이었던 점 일본어 수업을 담당하던 피고인이 수업 시작 직후 갑자기 이 사건 북침발언을 하였다는 것은 쉽게 납득하기 어렵다.
309835,판례내용,111,"H, N에 대한 검찰 진술조서 및 원심 법정진술에 대한 검찰 진술조서 작성의 진술서 및 원심 법정진술에 관하여 살피건대 H는 수사기관에서는 피고인이 이 사건 북침발언을 말하는 것을 들었다는 취지로 진술하였으나 원심 법정에서는 이와 달리 H는 피고인이 당시 미군이 먼저 쳐들어갔다는 말은 하지 않았다고 진술하였고 소송기록 제쪽은 피고인이 하는 말을 얼핏 들었고 미군이 먼저 북한으로 쳐들어갔다는 것인지 나중에 쳐들어갔다는 것인지는 잘 몰라도 미군이 쳐들어갔다는 말은 들은 것 같다라고 진술하였으며 소송기록 제쪽은 피고인은 북한이 남침을 한 후에 미군이 평양 함흥 등으로 쳐들어갔다고 말했다라고 진술하였는바 소송기록 제쪽의 수사기관에서의 각 진술은 주요 부분에 있어 원심 법정에서의 위 진술과도 배치되므로 위 각 수사기관에서의 진술은 그대로 믿기 어렵다."
309835,판례내용,112,"그 밖에 학생으로부터 들었다는 취지 당시 교장 담임으로부터 들었다는 취지의 원심 법정에서의 진술은 전문진술에 불과하고 피고인이 증거로 동의한 D의 부친으로부터 들었다는 취지, 국어교사 담임으로부터 들었다는 취지의 수사기관에서의 각 진술은 당시 수업시간에 피고인의 북침발언을 직접 들었다는 것이 아니고 D, F, G로부터 들었다는 것으로 이 부분 공소사실을 유죄로 삼기에 부족하다."
309835,판례내용,113,"오히려 이 사건 당시 교실에서 피고인의 수업을 들은 학생들은 여 명에 이르는데 그 중 앞서 본 명의 수사기관에서 진술이 있을 뿐인데 당시 수업에 참석한 학생들인 O, BB, CC, DD는 원심 법정에서 피고인이 이 사건 북침발언을 말한 사실이 없거나 피고인의 이 사건 북침발언을 들은 기억이 없다는 취지로 진술하였다."
309835,판례내용,114,특히 당시 교실 내에서 교탁 바로 앞에 앉아서 수업을 들은 반장 O는 원심 법정에서 피고인이 평양시가지 사진을 보여주면서 당시 미군공군기가 평양을 폭격했다는 말은 듣지 못하였다.
309835,판례내용,115,당시 미군공군기가 평양을 무자비하게 폭격했기 때문에 북한에서는 미군 북침으로 주장하고 남한에서는 인천상륙작전을 유엔군의 도움을 받아 했기 때문에 남침설이라고 한다고 말한 것으로 거의 확실하게 기억한다라고 진술하였고 소송기록 제쪽 당심 법정에서도 피고인이 수업시간에 북침이라고 가르친 적이 없었다라고 진술하였는바 O의 위 진술은 직접 경험한 사실을 구체적으로 묘사하고 있고 진술내용이 구체적이고 일관되어 신빙성이 높다고 판단되고 피고인의 주장에 부합하고 있다.
309835,판례내용,116,라 자 국가보안법위반의 점에 대한 사실오인 및 법리오해 주장에 관한 판단
309835,판례내용,117,1989.4.25.
309835,판례내용,118,검사가 제출한 증거들을 종합하면 피고인이 북한 주민들의 경제적인 상황 및 여가 활동 북한 도시의 모습 등에 대하여 일부 긍정적인 발언을 한 사실이 인정되기는 한다.
309835,판례내용,119,"그러나 설령 피고인이 이 부분 공소사실 기재와 같은 발언을 하였다고 하더라도 원심 및 당심이 적법하게 채택하여 조사한 증거들에 의하여 인정되는 아래와 같은 사실 및 사정들을 종합하여 보면, 피고인이 수업시간에 학생들을 대상으로 교육 목적 하에 시사적인 문제에 관하여 개인적인 의견을 표명한 정도에 불과한 것으로 보일 뿐이고 검사가 제출한 증거들만으로는 달리 그와 같은 행위가 객관적으로 반국가단체의 이익이 된다거나 피고인에게 주관적으로 반국가단체에 이롭다는 데 대한 인식이 있었다고 보이지 않으며 피고인의 행위가 국가의 존립안전이나 자유민주적 기본질서를 위태롭게 할 위험이 있는 경우에 해당한다고 보기도 어려우며 달리 이를 인정할 증거가 없다."
309835,판례내용,120,그럼에도 이 부분 공소사실을 유죄로 판단한 원심판결에는 사실을 오인하거나 법리를 오해하여 판결에 영향을 미친 위법이 있다.
309835,판례내용,121,피고인은 수사기관에서부터 일관되게 학생들이 북한에 대하여 다소 잘못 알고 있는 내용을 바로 알려주기 위해 사진을 이용해 북한의 현실에 대한 긍정적인 모습과 부정적인 모습을 설명하였을 뿐 북한을 찬양한 사실이 없다는 취지로 진술하였다.
309835,판례내용,122,이 부분 공소사실과 관련하여 피고인이 한 구체적인 발언내용에 관하여 D는 원심 법정에서 “피고인이 금강산 사진을 보여주면서 이렇게 아름다운 산하를 외국인은 가볼 수 있는데 우리민족은 가볼 수 없는 안타까움이 있고 언젠가 통일이 되면 여러분들도 수학여행이나 신혼여행을 가볼 수 있을 것이다라는 취지로 말하였다라고 진술하였고 소송기록 제쪽도 원심 법정에서 피고인이 사진을 보여주면서 건물이 높다는 말과 학생들이 생각하는 것만큼 북한도 그렇게 못 살지 않는다는 등의 말을 했다.
309835,판례내용,123,피고인이 학생들에게 북한이 좋다는 점을 가르치기 위해 사진을 보여주고 설명을 하였던 것으로 생각하지 않는다.
309835,판례내용,124,피고인이 통일을 바라고 민족을 사랑하는 마음에.서 사진을 보여주었다고 생각한다라고 진술하였는바 소송기록 제 쪽 피고인.
309835,판례내용,125,"(4○, 422), 의 발언을 들은 학생들의 입장에서도 피고인이 북한을 이롭게 한다는 인식하에 객관적으로 북한에게 이익이 되는 행위를 한 것으로 받아들여지지 않았던 것으로 보인다."
309835,판례내용,126,은 수사기관에서 O ③ 피고인이 김○ 동상이 있는 화보를 보여주면서는 실제의 “사람과 동상을 비교하면서 북한이 이와 같이 발전을 하였어도 아직까지 독재를 하고 있다는 등의 말을 하였다라고 진술하였고 증거기록 제 쪽.”
309835,판례내용,127,"(3○), 원심 법정에서도 피고 “인이 주체사상탑과 김○ 동상을 보여주면서 폐허가 된 당시보다는 발전했지만 동상 앞의 사람의 크기와 비교하면서 김○ 동상을 보아도 공산독재체제를 알 수 있으며 만약에 서울 시내에 주체사상탑이 있으면 가만히 놔두지 않을 것이라고 말했다라고.”"
309835,판례내용,128,"진술하였는바 소송기록 제 쪽 이에 의하면 피고인은 사진자료를 통해 북한의 독재 (443), 체제에 대한 부정적인 견해를 표명하기도 하였음을 확인할 수 있다."
309835,판례내용,129,결론 4.피고인의 항소는 이유 있으므로 형사소송법 제 조 제항에 의하여 원심판결을 파 364 6 기하고 변론을 거쳐 다시 아래와 같이 판결한다.
309835,판례내용,130,다시 쓰는 판결 이유 이 사건 공소사실은 별지 공소사실 기재와 같은바 이는 위 제항에서 본 바와 같이 3 범죄의 증명이 없거나 범죄로 되지 아니하는 때에 해당하므로 형사소송법 제 조에 325 의하여 피고인에게 무죄를 선고하되 형사소송법 제 조 본문에 의하여 이 판결의 요 440 지를 공시하기로 하여 주문과 같이 판결한다.
309835,판례내용,131,재판장 판사 오○ _________________________
309835,판례내용,132,판사 김○ _________________________
309835,판례내용,133,판사 성○ _________________________
