판례일련번호,구분,문장번호,내용
326026,판례내용,1,대전지방법원
326026,판례내용,2,제12형사부
326026,판례내용,3,판결
326026,판례내용,4,결사건 2022고합406 강간미수
326026,판례내용,5,피고인 A
326026,판례내용,6,"검사 최○(기소), 강○, 김○(공판)"
326026,판례내용,7,변호인 변호사 김○(국선)
326026,판례내용,8,판결선고 2023.4.7.
326026,판례내용,9,주문
326026,판례내용,10,피고인을 징역 1년에 처한다.
326026,판례내용,11,피고인에 대하여 40시간의 성폭력 치료프로그램 이수를 명한다.
326026,판례내용,12,피고인에게 아동·청소년 관련기관 등과 장애인 관련기관에 3년간 각 취업제한을 명한다.
326026,판례내용,13,이유
326026,판례내용,14,범죄사실
326026,판례내용,15,"피고인은 피해자 B(가명, 여, 88세)와 노인일자리 사업을 통해 알게 된 사이로, 2022.3.18."
326026,판례내용,16,"낮시간경 대전 대덕구 C, D호에 있는 피해자의 주거지에 따라간 후 집에 돌아가라며 현관에서 배웅을 하는 피해자를 손으로 밀어 억지로 방 안에 넣은 다음 피해자의 옷을 강제로 벗긴 후 손으로 밀쳐 그곳 침대에 눕히고 그 위에 올라타 피해자의 반항을 억압한 후 피해자의 음부에 손가락을 넣고, 입으로 가슴과 음부를 빨았으며, 피고인의 성기를 피해자의 음부에 삽입하려 하였으나 성기가 발기되지 아니하여 삽입하지 못하였다."
326026,판례내용,17,이로써 피고인은 피해자를 강간하려 하였으나 미수에 그쳤다.
326026,판례내용,18,증거의 요지
326026,판례내용,19,"1.B(가명), E, F의 각 법정진술"
326026,판례내용,20,1.피고인에 대한 일부 경찰 피의자신문조서
326026,판례내용,21,"1.B(가명), E, F에 대한 각 경찰 진술조서"
326026,판례내용,22,"1.진료기록지(순번 22), 응급키트 체크리스트(순번 23), 감정서(순번 39), 소견서(순번 46)"
326026,판례내용,23,"1.수사보고서(현장 확인 등)및 현장사진, 수사보고서(이동 동선 확인), 수사보고서(C아파트 CCTV 영상 확보 등), CCTV 영상 및 캡쳐사진, 수사보고서(피해자 면담)"
326026,판례내용,24,1.고소장 사본
326026,판례내용,25,"법령의 적용 1.범죄사실에 대한 해당법조 형법 제300조, 제297조"
326026,판례내용,26,"1.법률상 감경 형법 제25조 제2항, 제55조 제1항 제3호(미수)"
326026,판례내용,27,"1.정상참작감경 형법 제53조, 제55조 제1항 제3호(아래 ‘양형의 이유’ 중 유리한 정상 참작)"
326026,판례내용,28,1.이수명령 성폭력범죄의 처벌 등에 관한 특례법 제16조 제2항 본문
326026,판례내용,29,"1.공개명령 및 고지명령의 면제 성폭력범죄의 처벌 등에 관한 특례법 제47조 제1항, 제49조 제1항, 아동·청소년의 성보호에 관한 법률 제49조 제1항 단서, 제50조 제1항 단서(기록에 의하여 인정되는 다음과 같은 사정, 즉 ① 피고인에게 성범죄로 처벌받은 전력이 없는 점, ② 불특정 다수인을 상대로 한 범행은 아니었던 점, ③ 피고인에 대한 신상정보 등록, 성폭력 치료강의 수강명령 및 취업제한명령만으로도 어느 정도 재범 방지 효과를 거둘 수 있다고 보이는 점, ④ 그 밖에 피고인의 나이, 성행, 이 사건 범행의 내용, 동기, 공개·고지명령으로 인하여 피고인이 입는 불이익의 정도와 예상되는 부작용, 그로 인해 달성할 수 있는 성범죄의 예방 및 피해자 보호 효과 등을 종합적으로 고려하여 볼 때 신상정보를 공개·고지하여서는 아니 될 특별한 사정이 있다고 판단된다.)"
326026,판례내용,30,"1.취업제한명령 아동·청소년의 성보호에 관한 법률 제56조 제1항 본문, 장애인복지법 제59조의3 제1항 본문"
326026,판례내용,31,"피고인과 변호인 주장에 관한 판단 1.주장의 요지 피고인은 피해자와 합의 하에 성관계를 시도하였을 뿐, 판시 범죄사실 기재와 같이 폭행 또는 협박으로 강간을 시도한 사실이 없다."
326026,판례내용,32,"2.관련법리 가.피해자의 진술은 그 진술 내용의 주요한 부분이 일관되며, 경험칙에 비추어 비합리적이거나 진술 자체로 모순되는 부분이 없고, 또한 허위로 피고인에게 불리한 진술을 할 만한 동기나 이유가 분명하게 드러나지 않는 이상, 그 진술의 신빙성을 특별한 이유 없이 함부로 배척해서는 아니 된다."
326026,판례내용,33,"성폭행 피해자의 대처 양상은 피해자의 성정이나 가해자와의 관계 및 구체적인 상황에 따라 다르게 나타날 수밖에 없으므로, 개별적·구체적인 사건에서 성폭행 등의 피해자가 처하여 있는 특별한 사정을 충분히 고려하지 않은 채 피해자 진술의 증명력을 가볍게 배척하는 것은 정의와 형평의 이념에 입각하여 논리와 경험의 법칙에 따른 증거판단이라고 볼 수 없다(대법원 2020.6.25."
326026,판례내용,34,선고 2020도2473 판결 참조).
326026,판례내용,35,"나.강간죄에서 공소사실을 인정할 증거로 사실상 피해자의 진술이 유일한 경우 피고인의 진술이 경험칙상 합리성이 없고 그 자체로 모순되어 믿을 수 없다고 하여 그것이 공소사실을 인정하는 직접증거가 되는 것은 아니지만, 이러한 사정은 법관의 자유판단에 따라 피해자 진술의 신빙성을 뒷받침하거나 직접증거인 피해자 진술과 결합하여 공소사실을 뒷받침하는 간접정황이 될 수 있다(대법원 2018.10.25."
326026,판례내용,36,선고 2018도7709 판결 등 참조).
326026,판례내용,37,"3.인정사실 이 법원이 적법하게 채택하여 조사한 증거들에 의하면, 다음과 같은 사실이 인정된다."
326026,판례내용,38,가.피고인과 피해자는 대전광역시 대덕구청에서 주관하는 노인·중장년 일자리 공공근로 사업을 신청하여 대덕구 G 담당 공공근로자로 배정된 사람들이다.
326026,판례내용,39,나.피고인과 피해자가 주로 수행하는 도로 등 환경 미화 업무는 2인 1조 방식으로 약 3시간(오전 7시경부터 10시경까지) 가량 진행된다.피고인과 피해자는 서로 다른 조에 소속되어 있다.
326026,판례내용,40,다.이 사건 발생일인 2022.3.18.
326026,판례내용,41,전후에 해당하는 피고인과 피해자의 『2022년 3월』 일(요일)14(월)15(화)16(수)17(목)18(금)19(토)20(일)21(월)22(화)23(수)24(목)비고 사건당일 고소일 근로일은 아래 표 중 음영으로 표시한 일자이다.피고인과 피해자는 2022.3.14.경 처음 보았다.
326026,판례내용,42,<2022.3.>
326026,판례내용,43,라.피고인과 피해자는 같은 아파트에 거주한다.이들은 2022.3.18.
326026,판례내용,44,"공공근로를 마치고 같은 날 10:07경 피해자의 집에 들어갔고, 피고인은 약 4시간이 경과한 같은 날 14:12경 홀로 피해자의 집에서 나와 귀가하였다."
326026,판례내용,45,마.피해자는 2022.3.22.
326026,판례내용,46,"오전경 노인 맞춤돌봄 서비스를 통해 알게 된 생활지원사 E과 함께 대전대덕경찰서를 방문하였고, ‘피고인이 2022.3.18."
326026,판례내용,47,10:30경 ~ 16:00경 피해자의 집에서 피해자로부터 밑반찬을 받고 현관문을 열고 나가려다가 피해자를 힘으로 방으로 끌고 들어간 다음 강간하려고 하였다’는 취지의 고소장을 제출하였다.피해자가 피고인을 고소한 날짜는 이 사건 발생일 이후 예정된 피고인과 피해자의 첫번째 근로일이었다.
326026,판례내용,48,"4.판단 위 인정사실에 이 법원이 적법하게 채택하여 조사한 증거들에 의하여 인정되는 다음과 같은 사실 및 사정들에 비추어 보면, 피고인이 피해자를 강간하려다가 미수에 그친 사실이 인정된다."
326026,판례내용,49,따라서 피고인 및 변호인의 주장은 받아들이지 않는다.
326026,판례내용,50,"가.피해자의 진술은 비교적 구체적이고, 일관된다."
326026,판례내용,51,"1)피해자는 수사기관부터 이 법정에 이르기까지 아래와 같이 ‘피고인이 공공근로를 마치고 피해자의 집에 따라왔고, 피해자로부터 밑반찬을 받아 집에 가려던 피고인이 고소장(증거기록 제2쪽) 4.고소사실 피해자의 거주지인 C아파트에서 밑반찬을 받은 후 피고소인이 나가려고 하여 현관문을 열고 나가려다가 욕정을 일으켜 힘으로 끌어안고 사건 장소인 방으로 끌고 들어갔다.그리고 나서 고소인을 강간하려고 한 것임 경찰 진술조서(증거기록 제11쪽) 2022.3.18."
326026,판례내용,52,"10:30분쯤 피○이 밑반찬을 가지러 저희집으로 왔어요.그리고 제가 집으로 가라 그랬는데 현관문○을 열고 나가려다가 갑자기 돌아서서 저를 힘으로 끌어안았어요.경찰 진술조서 2회(증거기록 제138쪽) 그 사람이 이렇게 현관문○ 쪽을 바라보고 있었고, 제가 그 뒤에서 현관문○을 닫으려고 했어요.근데 이 사람이 뒷걸음질을 하면서 나를 침대 있는 방으로 밀면서 들어오는거야.피해자에 대한 증인신문○ 녹취서 제5쪽 문○ 그런데 피고인이 다시 증인의 집으로 밀고 들어온거에요 답 예.한 발짝 더 나가면 되는데 휙 돌아서서는 식탁에다가 보따리 놓고서는 나를 방으로 밀더라고요.갑자기 피해자를 안방으로 밀치고 강제로 옷을 벗겼다’는 취지로 진술하고 있다.피고인이 이 사건 범행을 착수할 당시 상황에 관한 피해자의 진술이 일관된다."
326026,판례내용,53,"2)피해자는 이 법정에서 피고인의 범행 방법, 범행 당시 상황이나 피해자가 느꼈던 감정에 관해 “나는 힘이 없으니까 내가 해 볼 수가 없더라고요.전화도 손에 안들었지 아무것도 없는데 억센 놈을 해볼 수가 없더라고요”, “피고인이 강제로 눕힌 곳이 방바닥인지 침대인지도 분간도 못해요”, “아래도 빨고, 가슴도 빨고, 다 헤졌어요”, “(성기가)들어가지도 않고 지가 막 손가락을 집어넣고 휘저었어요.(발기가 되지 않아서)안들어가니까 막 손으로 후벼갖고 다 헤졌어요.다음에는 약 먹고 빳빳하게 해갖고 와서 재미있게 해준다고 그러더라고요”라고 증언하였다."
326026,판례내용,54,이 부분 피해자의 증언은 직접 경험하지 않고 꾸며내었다고 보기 어려울 정도로 생생하고 구체적이다.
326026,판례내용,55,더욱이 위 증언은 피고인의 구체적 범행 경위에 관해 설명해 달라는 검사의 질문에 수치심이 가득한 표정으로 고소장에 기재된 내용이나 수사기관에서의 진술을 증언으로 갈음해달라며 대답을 수차례 주저하다가 이루어진 일련의 내용이다(피해자에 대한 증인신문 녹취서 제9쪽).
326026,판례내용,56,증언 전 피해자의 태도를 보더라도 그 신빙성을 의심하기는 어렵다.
326026,판례내용,57,3)피해자는 피고인을 알게 된 이후 2번째 근로일이자 이 사건 발생 이틀 전인 2022.3.16.에도 피해자의 집 앞에서 피고인 및 피고인과 같은 조로 일하는 성명불상의 여성에게 피해자가 며칠 전 캔 나물을 건네주었던 것으로 보인다(피해자에 대한 증인신문 녹취서 제3쪽).
326026,판례내용,58,"피해자와 같은 아파트에 거주하는 피고인이 공공근로를 마치고 피해자와 함께 귀가하다가 피해자를 따라왔고, 피고인이 혼자 산다고 말하기에 김치나 장아찌 등 밑반찬을 싸주게 되었다는 이 사건 직전 상황이나 피고인의 방문 경위에 관한 피해자의 진술도 이 사건 범행 전 피고인과 피해자의 관계에 부합하고, 합리적이다."
326026,판례내용,59,"나.고령인 피해자의 나이나 건강상태 등 특성에 비추어 보아도, 피해자의 진술이 변경되어 신빙성이 없다거나, 모순된다고 보기 어렵다."
326026,판례내용,60,"피해자는 이 사건 범행 직전 피해자의 착의 상태나 범행 당시 탈의된 순서에 관하여, 경찰 제1회 조사에서는 ‘상의는 면티에 패딩 잠바, 하의는 검은색 바지를 입었다.피고인이 1)이 사건 기록상 성명 등 인적사항이 분명하지 않다.2)피고인과 피해자가 아파트 단지로 들어온 다음 피해자의 집까지 함께 걸어가는 일부 장면이 촬영된 CCTV 영상(증거기록 제89쪽)에 의하면, 이들이 대화를 하는 듯한 거동은 확인되지 않고, 그저 걸어가고 있는 장면만이 확인된다.피해자가 경찰 제1회 조사 당시 입고 있던 점퍼의 형상을 고려하면 피해자의 상의 탈의 없이 위와 같은 행위가 이루어지기는 어렵다.피해자는 이 법정에서 ‘경찰 제2회 조사 과정에서 진술한 “편한 얇은 옷을 입은 상태”는 입고 있던 조끼를 벗은 상태라는 의미로 진술한 것이다‘라며 이 사건 범행 직전 피해자의 착의 상태를 보다 분명하게 증언하였다.위 CCTV상 피해자가 조끼 안에 입고 있었던 상의는 얇은 점퍼이고, 점퍼의 경우 그 형상에 비추어 일종의 외투로 확인되는 점에서 피해자가 경찰 제1회 조사 당시 입고 있었다고 진술한 “패딩 잠바”는 위 얇은 점퍼를 지칭했던 것으로 보인다.결국 범행 당시 피해자의 착의 상태에 관한 피해자의 진술은 경찰 제1회 조사 때부터 이 법정에 이르기 까지 ’공공근로를 마치고 돌아와 조끼만을 벗고 (얇은)점퍼를 입고 있는 상태였다‘는 것으로서 일관된다."
326026,판례내용,61,"2)탈의 순서 부분 피해자에 대한 경찰 제1회 진술조서 중 탈의 경위에 관한 피해자의 진술은 수사관이 피해자로부터 “피고인이 방으로 끌고 들어가서 피해자의 하의를 벗기고, 그 다음 피고인이 스스로 하의를 벗었다”는 진술을 듣자 바로 그 시점에서의 착의 상태를 분명하게 확인하기 위해 피해자에게 “피고소인이랑 고소인 둘 모두 위에만 입고 밑에는 벗은 상태가 된거네요”라고 건넨 질문에 “네”라며 동조한 것이 유일하다(증거기록 제12쪽)."
326026,판례내용,62,"피해자의 경찰 2회 조사에서의 이 부분 진술은 “(피고인이)전부 벗겼다.거실에서부터 바지 같은 것 억지로 벗겼다.”는 것으로서 피고인이 피해자의 바지부터 벗기기 시작하여 피해자의 옷을 전부 벗겼다는 취지이다.탈의 순서에 관한 수사기관에서의 피해자 진술을 종합하면, ’피고인이 피해자의 하의를 벗기기 시작하여 결국 옷 전부를 벗겼다‘는 내용인데, 그중 ’피고인이 피해자의 하의를 벗기기 시작하였다‘는 부분은 ’피고인이 피해자의 상의를 먼저 벗겼다‘는 취지인 이 법정에서의 일부 증언과 배치된다."
326026,판례내용,63,그러나 피해자는 이 사건 당시 만 88세의 고령이었다.이 법정에서의 증언은 이 사건 발생일로부터 1년이 경과한 시점에서 이루어졌다.피고인이 범행 당시 피해자의 상의와 하의 중 무엇을 먼저 벗겼는지에 관한 진술은 당시 만 88세인 피해자의 나이나 건강 상태에 따른 기억의 한계로 일관되지 못할 수 있다.
326026,판례내용,64,뿐만 아니라 “윗도리부터 싹 벗겼다”는 피해자의 증언은 피고인이 옷을 전부 벗겨 피해자가 결국 나체 상태였다는 것으로서 수사기관에서의 진술과 전부 배치된다고 보기도 어렵다.
326026,판례내용,65,"3)위 증언 이후 피해자가 재차 “그냥 막 벗기더라고요”라고 증언한 점을 보태어 보면, 피해자가 이 사건 범행 당시 인식하거나 기억하고 있는 탈의 경위에 관한 중요 기억은 피고인이 피해자의 하의를 먼저 벗겼다거나 상의를 먼저 벗겼다는 등 그 순서에 있는 것이 아니라 피해자의 옷을 전부 벗겼다는 결과에 있는 것으로 보인다."
326026,판례내용,66,"게다가 이 사건 범행 대상이 된 피해자의 신체 부위는 피해자의 가슴, 음부 등에 집중되어 있고, 해당 부위에 대한 피고인의 신체적인 유형력 행사는 수회 반복된 것으로 보이는바, 피해 부위나 범행 내용에 비추어 보더라도, 탈의 순서 등 경위는 이 사건에 있어 상대적으로 지엽적인 부분에 해당한다."
326026,판례내용,67,또한 피해자의 진술은 피고인이 현관문을 나가려다가 바로 뒤로 돌아 기습적으로 피해자의 항거가 불가능하도록 물리력을 행사하였다는 것이다.범행 자체가 급작스럽게 이루어졌던 점에서 피해자가 범행 당시 느꼈을 공포나 두려움으로 인해 범행에 수반되는 탈의에 관한 부분의 기억력이 피해자의 기억에 객관적으로 정확하거나 분명하게 남기는 어려웠을 것으로도 보인다.
326026,판례내용,68,피고인이 피해자의 옷 전부를 벗겼다는 진술 또는 증언에 포함되는 탈의 순서에 관한 피해자의 진술이 일부 부정확하거나 이 법원에 이르러 일부 변경된 사정만으로는 피해자 진술의 신빙성을 배척할 수 없다.
326026,판례내용,69,"3)음주 여부 부분 피해자에 대한 제1회 경찰 진술조서의 진술기재에 따르면, 피해자에 대한 경찰 제1회 조사 과정에서 이 사건 당일 피고인 또는 피해자의 음주 여부나 음주량에 관한 수사관의 질문이나 조사 자체가 없었던 것으로 보인다."
326026,판례내용,70,피해자는 고소 다음날인 2022.3.23.
326026,판례내용,71,"피해자의 집에서 이루어진 현장 조사 과정에서, 수사관에게 ’피해자가 피고인에게 술을 한잔 따라주었고, 자신도 한잔 마셨다‘며 피해자의 음주 사실을 순순히 인정하였다(증거기록 제46쪽)."
326026,판례내용,72,달리 피해자가 제1회 조사 과정에서 피해자나 피고인의 음주 사실에 관해 고의로 은폐하거나 허위로 진술하였다고 인정할 만한 사정은 찾기 어렵다.
326026,판례내용,73,피해자가 제1회 경찰 조사 당시 이 사건 당일 피고인과 피해자의 음주사실을 진술하지 않았다는 점 역시 피해자 진술의 신빙성을 의심하게 할 사정이 되지 못한다.
326026,판례내용,74,다.관련자들의 진술이나 피해자의 진료 기록 등이 피해자의 진술에 구체적으로 부합한다.
326026,판례내용,75,1)노인·중장년 일자리 공공근로 현장에서 피고인과 피해자를 관리하는 F은 수사기관에서 ’2022.3.21.
326026,판례내용,76,"7시경 피해자로부터 드릴 이야기가 있다는 전화를 받고 피해자의 주거지에 있는 놀이터에서 피해자를 만났다.피해자가 당시 하는 말이 노인 일자리 근로를 마치고 집에 가는데 피고인이 오지 말라고 하는데도 따라왔고, 집에 들어와서 강제로 껴안고 물어뜯고 핥았다는 말을 했다.그때 좀 특이했던 것은 피해자가 평소에는 지팡이를 사용하지 않는데, 그때는 지팡이를 짚고 왔다.(중략)그때 피해자가 죽고 싶다는 말도 하고 나는 어떻게 해, 어떻게 해 하는 말도 반복하고 눈물까지 보이는 모습을 보고 성폭행 피해를 당했구나라는 생각이 들었다‘라는 취지로 진술하였다."
326026,판례내용,77,피해 경위에 관한 이 사건에서의 피해자의 진술이 고소 이전부터 일관되었음을 보여준다.
326026,판례내용,78,피해자가 이 사건 발생일로부터 3일이 경과한 시점까지도 평소 사용하지 않는 지팡이를 사용한 점은 피고인의 피해자에 대한 유형력의 행사가 피해자의 신체능력이나 건강상태에 비추어 상당하였음을 시사한다.
326026,판례내용,79,2)생활지원사 E은 수사기관에서 ’2022.3.21.
326026,판례내용,80,"21:30경 피해자로부터 성추행을 당했다는 전화를 받고 피해자 집에 방문하였는데, 당시 피해자로부터 피고인이 일을 마치고 집을 따라 왔길래 그냥 보낼 수 없어서 밑반찬과 오래된 약술을 줘서 보내려고 있는데 갑자기 (피고인이)돌변해서 옷을 강제로 벗기고, 침대에 눕힌 다음 성추행을 하고, 강간을 하려고 했다는 말을 들었다‘는 취지로 진술하였다."
326026,판례내용,81,"당시 피해자가 호소한 통증이나 후유증이 있었냐는 수사관의 질문에는 ”아래도 좀 아프고, 정신적으로 충격을 받아서 그런지 한 이야기를 또 하고 또 하고 했어요.자식들에게 절대 알려서는 아니 된다는 말씀을 반복해서 하셨어요.너무 기운이 없어서 몸도 씻지 못했다고 했어요“라고 대답하기도 하였다."
326026,판례내용,82,피해자가 당시 E에게 전한 이 사건 경위도 고소 이후 피해자의 진술과 구체적으로 일관된다.
326026,판례내용,83,"이 사건 직후 피해자의 신체적, 정신적 상태에 관한 E의 진술을 보면, 피고인의 범행이 피해자에게 신체적으로는 물론 정신적으로도 상당한 악영향을 주었던 것으로 보인다."
326026,판례내용,84,3)피해자가 고소한 당일인 2022.3.22.자 『성폭력 피해자 진료기록』에는 ”① 샤워나 목욕을 하였다.② 질 또는 항문을 세척하였다“라는 체크리스트 항목에 모두 ”아니오“로 표기되어 있다(증거기록 제61쪽).
326026,판례내용,85,피해자는 이 법정에서 이 사건 이후 건강 상태에 관해 ”그렇게 당하고서 제가 못 일어났어요.못 일어나고 일주일 있다가 내가 살아야겠다 해서 일어나가지고 반장한테 연락을 했어요“라고 증언하였다(피해자에 대한 증인신문 녹취서 제9쪽).
326026,판례내용,86,E도 앞서 본 바와 같이 수사기관에서 ’2022.3.21.
326026,판례내용,87,"피해자를 만났을 당시 피해자가 기운이 없어 몸도 씻지 못한 상태였다‘고 진술한바, 진료기록에 기재된 내용은 이 사건 범행 직후 피해자의 상태에 관한 피해자의 진술에도 부합한다."
326026,판례내용,88,게다가 E이 피해자를 만난 날은 이 사건 발생일로부터 3일이 지난 시점이다.
326026,판례내용,89,"피고인의 유형력 행사의 정도가 상당하였을 것으로 보이고, 그로 인해 추정되는 이 사건 범행 직후 피해자의 상태에 비추어, 피해자가 사고 당일 피해 사실을 제3자 등 외부에 곧바로 알리지 못한 사정도 납득된다."
326026,판례내용,90,"라.아래 사정에 비추어, 고소 경위나 시점이 자연스럽고, 이 사건 범행으로 피해자가 피고인에 대하여 상당한 두려움을 가지고 있었음을 시사한다."
326026,판례내용,91,1)피해자는 이 사건 발생일 이루어진 피고인의 유형력으로 상당한 신체적 후유증을 입고 며칠간 별다른 활동을 할 수 없었던 상태였던 것으로 보인다.
326026,판례내용,92,2)피고인은 피해자가 그와 같은 상태에 있었던 2022.3.21.
326026,판례내용,93,수차례 피해자의 집에 찾아가 문을 두드렸다.
326026,판례내용,94,"그 직후 피해자는 19:00경 F을 만나 피해 사실을 말하였고, 21:30경에는 E에게도 피해 사실을 알렸다."
326026,판례내용,95,2022.3.21.
326026,판례내용,96,"피해자를 만난 F과 E 모두 ’피해자가 당시 피고인이 피해자의 집에 수차례 찾아와 문을 두드려 무섭다라는 취지로 말하였다‘고 진술하고 있다(증거기록 제97쪽, F에 대한 증인신문 녹취서 제17쪽)."
326026,판례내용,97,피고인에 대한 고소를 결심한 시점까지도 피해자가 E에게 피해자의 자식들에게만큼은 절대 알리지 말아달라는 말을 한 사정(증거기록 제98쪽)이나 이 사건 범행 이후 집으로 가려는 피고인에게 ”다른 사람한테 이야기 하지 말아라.아들들이 알면 큰일난다“라고 까지 말하였다.
326026,판례내용,98,피고인은 수사기관에서 2022.3.21.
326026,판례내용,99,"3회에 걸쳐 피해자의 집에 찾아갔다고 진술하고 있고, E은 수사기관에서 피해자로부터 ‘피고인이 5~6회 찾아왔고, 찾아올 때마다 30분만 문을 두드렸다.무서워서라도 신고를 해야겠다.’는 이야기를 들었다고 진술하였다."
326026,판례내용,100,"피고인이 수차례 집을 찾아갔고, 상당한 시간 동안 문을 두드렸던 것으로 보인다."
326026,판례내용,101,"이는 피해자의 이 법정에서의 증언 등에 비추어, 피해자는 이 사건 범행에도 불구하고 상당 기간 그 범행 사실을 가족이나 외부의 시선 또는 걱정 등을 우려하여 밝히지 않으려 하다가 피해자의 집에 수차례 찾아온 피고인의 행동에 두려움을 느껴 고소를 결심한 것으로 보인다."
