판례일련번호,구분,문장번호,내용
321724,판례내용,1,대구지방법원
321724,판례내용,2,판결
321724,판례내용,3,"사건 2022고단3192, 2022고단4555(병합), 2022고단5103(병합)사기, 사기방조, 컴퓨터등사용사기, 컴퓨터등사용사기미수 2022초기2225, 2022초기2226, 2022초기2228, 2022초기2229, 2022초기2234, 2022초기2237, 2022초기2241, 2022초기2242, 2022초기2244, 2022초기2261, 2022초기2262, 2022초기2267, 2022초기2268, 2022초기2274, 2022초기2275, 2022초기2293, 2022초기2434, 2022초기2564, 2022초기2632, 2022초기3399, 2022초기3407, 2022초기3434, 2022초기3446, 2022초기3500, 2022초기3555, 2022초기3638 배상명령신청"
321724,판례내용,4,피고인 A
321724,판례내용,5,"검사 박○, 김○, 이○(기소), 박○(공판)"
321724,판례내용,6,변호인 변호사 성광해(국선)
321724,판례내용,7,배상 신청인 별지 기재와 같다.
321724,판례내용,8,판결 선고 2023.8.16.
321724,판례내용,9,주 문
321724,판례내용,10,피고인을 징역 1년 8개월에 처한다.
321724,판례내용,11,피고인은 별지 기재 각 배상신청인에게 별지 기재 각 편취금을 각 배상하라.위 각 배상명령은 각 가집행할 수 있다.
321724,판례내용,12,이 유
321724,판례내용,13,범죄 사실 [범죄전력] 피고인은 2020.5.12.
321724,판례내용,14,대구지방법원에서 위작사전자기록등행사죄 등으로 징역 2년을 선고받고 2021.10.20.
321724,판례내용,15,창원교도소에서 그 형의 집행을 종료하였다.
321724,판례내용,16,"[범죄사실] 『2022고단3192』 1.사기 피고인은 2021.12.6.경 장소를 알 수 없는 곳에서 인터넷 사이트 ’B‘에 접속하여 ‘명품 가방을 판매한다’는 글을 게시하고, 이를 보고 연락한 피해자 C에게 ‘돈을 먼저 송금해주면 가방을 배송해 주겠다’라는 취지로 거짓말을 하였다."
321724,판례내용,17,"그러나 사실 피고인은 피해자에게 위와 같이 판매할 명품 가방을 보유하고 있지 않았고, 피해자로부터 돈을 송금받아 생활비 등으로 사용할 생각이었을 뿐이었으므로, 피해자에게 가방을 판매할 의사나 능력이 없었다."
321724,판례내용,18,"피고인은 이와 같이 피해자를 속여 이에 속은 피해자로부터 2021.12.6.경 ‘입생로랑’ 가방 판매대금 명목으로 650,000원을, 2021.12.7.경 ‘구찌’ 가방 판매대금 명목으로 650,000원을 피고인 명의의 D 계좌(계좌번호 1 생략)로 2회에 걸쳐 각 송금받은 것을 비롯하여, 그 때부터 2021.12.8.경까지 “별지 범죄일람표 1” 기재와 같이 총 2명의 피해자로부터 4회에 걸쳐 위와 같은 명목으로 합계 2,204,000원을 송금받아 편취하였다."
321724,판례내용,19,"2.사기방조 피고인은 2022.1.초순경 대구 수성구 E건물, F호에 있는 피고인의 집에서 피고인의 휴대폰을 이용하여 ‘G’ 어플에 접속한 후 ‘재택근무 아르바이트’를 모집하는 글을 보고 성명불상자에게 연락하고, 성명불상자로부터 ‘계좌번호를 알려주면 그 계좌로 돈을 보내줄 테니 그 돈으로 H상품권을 할인 판매하는 사이트에서 H상품권을 구입하고, 이 때 할인받은 차액은 대가 명목으로 피고인이 갖는 대신 H상품권의 핀 번호를 알려 달라’는 제안을 받아 이를 승낙하고, 성명불상자가 아래와 같이 사기 범행을 한다는 사실을 알면서도 이를 돕기 위하여 피고인의 주민등록등본 캡쳐 사진, 피고인 명의의 I 계좌(계좌번호 2 생략), D 계좌(계좌번호 1 생략), J 계좌(계좌번호 3 생략)의 계좌번호를 성명불상자에게 알려주었다."
321724,판례내용,20,"한편 성명불상자는 2022.1.3.경 장소를 알 수 없는 곳에서 인터넷 사이트 ‘K’에 ‘명품 가방을 판매한다’는 글을 게시하고, 이를 보고 연락해 온 피해자 L에게 ‘돈을 송금해주면 가방을 배송해 주겠다’는 취지로 거짓말을 하였다."
321724,판례내용,21,"그러나 사실 성명불상자는 피해자에게 판매할 명품 가방을 보유하고 있지 않았고, 피해자로부터 돈을 받더라도 약속대로 가방을 보내줄 의사나 능력이 없었다.성명불상자는 이와 같이 피해자를 기망하여 같은 날 피고인 명의의 D 계좌(계좌번호 1 생략)로 가방 판매대금 명목으로 750,000원을 송금받은 것을 비롯하여 “별지 범죄일람표 2” 기재와 같이 피해자 총 34명으로부터 같은 명목으로 합계 35,665,000원을 피고인 명의의 계좌로 송금받고, 피고인은 2022.1.3.경 피고인 명의의 계좌에 피해금이 입금되자 성명불상자가 지시한 대로 같은 날 인터넷 사이트 ‘M’에서 H상품권을 구매하여 그 핀번호(N)를 성명불상자에게 카카오톡으로 알려준 것을 비롯하여, 그 때부터 2022.1.15.경까지 “별지 범죄일람표 3” 기재와 같이 총 249회에 걸쳐 위와 같은 방법으로 H상품권을 구매하고 핀 번호를 성명불상자에게 알려주어, 성명불상자의 사기 범행을 용이하게 하여 방조하였다."
321724,판례내용,22,『2022고단4555』 1.컴퓨터등사용사기 피고인은 2022.3.5.
321724,판례내용,23,"21:34경 대구 수성구 O 소재 피해자 P이 관리하는 Q 수성점 셀프계산대에서 시가 합계 54,880원 상당의 오리고기 1개, 우삼 양지구이 2개를 구매하면서, 그곳 셀프계산대에 설치된 정보처리장치인 바코드 인식기에 허위의 정보가 입력된 시가 3,390원 상당의 ‘돼지불고기용(팩)’, 시가 3,190원 상당의 ‘찌개용(뒷다리)큐브팩’ 및 시가 3,190원 상당의 ‘다짐용(뒷다리)큐브팩’ 제품의 바코드를 인식시켜 합계 9,770원이 결제되는 정보처리를 하게 함으로써 그 차액인 45,110원의 재산상 이득을 취득하는 등 그때부터 2022.3.23.까지 별지 범죄일람표 4 기재와 같이 총 10회에 걸쳐 위와 같은 방법으로 차액 842,090원의 재산상 이득을 취하였다."
321724,판례내용,24,2.컴퓨터등사용사기미수 피고인은 2022.3.24.
321724,판례내용,25,"제1항 기재 장소에서 피해자가 관리하는 시가 129,310원 상당의 양고기 2개, 엑스레이티드 1개, 우유 1개, 맥주 2팩을 구매하면서 그곳 셀프개산대에 설치된 정보처리장치인 바코드 인식기에 허위의 정보가 인식된 시가 790원 상당의 ‘버섯’ 2개, 시가 1,250원 상당의 ‘소시지’ 3개, 시가 580원 상당의 ‘파채’ 등의 바코드를 인식시켜 5,910원이 결제되는 정보처리를 하게 함으로써 그 차액인 123,400원의 재산상 이득을 취득하려고 하였으나 이를 발견한 마트 직원이 제지하여 그 뜻을 이루지 못하고 미수에 그쳤다."
321724,판례내용,26,"『2022고단5103』 1.사기 피고인은 2022.6.10.경 대구 수성구 E건물, F호 소재 피고인의 주거지에서 인터넷 사이트 ‘K’에 “임○ 콘서트 티켓을 판매한다”는 글을 게시하고 이를 보고 연락한 피해자 R에게 “판매금을 입금하여 주면 임○ 콘서트 티켓을 보내주겠다”라고 거짓말하였다."
321724,판례내용,27,"그러나 사실 피고인은 판매할 콘서트 티켓을 가지고 있지 않았고, 피해자로부터 돈을 송금받아 생활비 등으로 사용할 생각이었을 뿐이므로 피해자에게 콘서트 티켓을 판매할 의사나 능력이 없었다."
321724,판례내용,28,"피고인은 이와 같이 피해자를 기망하여 이에 속은 피해자로부터 같은 날 피고인 명의 S은행 예금계좌(계좌번호 4 생략)로 230,000원을 송금받은 것을 비롯하여 그때부터 같은 해 7.23.까지 별지 범죄일람표 5 기재와 같이 총 14회에 걸쳐 합계 4,660,000원을 송금받았다."
321724,판례내용,29,"2.사기방조 피고인은 2022.1.초순경 대구 수성구 E건물, F호에 있는 피고인의 집에서 피고인의 휴대폰을 이용하여 ‘G’ 어플에 접속한 후 ‘재택근무 아르바이트’를 모집하는 글을 보고 성명불상자에게 연락하고, 성명불상자로부터 ‘계좌번호를 알려주면 그 계좌로 돈을 보내줄테니 그 돈으로 H상품권을 할인 판매하는 사이트에서 H상품권을 구입하고, 이 때 할인받은 차액은 대가 명목으로 피고인이 갖는 대신 H상품권의 핀 번호를 알려 달라’는 제안을 받아 이를 승낙하고, 성명불상자가 아래와 같이 사기 범행을 한다는 사실을 알면서도 이를 돕기 위하여 피고인의 주민등록등본 캡쳐 사진, 피고인 명의의 I 계좌(계좌번호 2 생략), J 계좌(계좌번호 3 생략)의 계좌번호를 성명불상자에게 알려주었다."
321724,판례내용,30,"한편 성명불상자는 2022.1.10.경 장소를 알 수 없는 곳에서 인터넷 사이트 ‘K’에 ‘샤넬 가방을 판매한다’는 글을 게시하고, 이를 보고 연락해 온 피해자 T에게 ‘돈을 송금해주면 가방을 배송해 주겠다’는 취지로 거짓말을 하였다."
321724,판례내용,31,"그러나 사실 성명불상자는 피해자에게 판매할 명품 가방을 보유하고 있지 않았고, 피해자로부터 돈을 받더라도 약속대로 가방을 보내줄 의사나 능력이 없었다."
321724,판례내용,32,"성명불상자는 이와 같이 피해자를 기망하여 같은 날 피고인 명의의 I 계좌(계좌번호 2 생략)로 가방 판매대금 명목으로 600,000원을 송금받고, 피고인은 피고인 명의의 계좌에 피해금이 입금되자 성명불상자가 지시한 대로 같은 날 인터넷 사이트 ‘U’에서 H상품권을 구매하여 그 핀번호 불상을 성명불상자에게 카카오톡으로 알려준 것을 비롯하여 “별지 범죄일람표 6” 기재와 같이 같은 달 14.까지 피해자 총 2명으로부터 같은 명목으로 합계 1,200,000원을 피고인 명의의 계좌로 송금받고, 성명불상자가 지시한 대로 H상품권을 구매하여 그 핀번호 불상을 성명불상자에게 카카오톡으로 알려주는 방법으로 성명불상자의 사기 범행을 용이하게 하여 방조하였다."
321724,판례내용,33,"증거의 요지 1.판시 전과(『2022고단3192』, 『2022고단4555』, 『2022고단5103』 사건 공통): 수사보고(피의자 동종전력 확인), 각 판결문 등, 수사보고(피의자 누범 사실 확인), 각 범죄경력등조회회보서(A), 범죄경력조회, 수사보고(피의자 누범기간 중 확인), 수사 상황(피의자 A 기존 처벌전력 및 재판진행 사건 등 확인)『2022고단3192』 1.제2회 및 제3회 공판조서 중 피고인의 각 진술기재 1.C의 경찰진술조서 1.L, V, W, X, Y, Z, AA, AB, AC, AD, AE, AF, AG, AH, AI, AJ, AK, AL, AM, AN, AO, AP, AQ, AR, AS, AT, AU, AV, AW, AX, AY, AZ, BA, BB, BC의 각 진술서 1.입건전조사보고서(증거목록 순번 147), 수사보고서 및 첨부자료(증거목록 순번 157 내지 160, 163)1.각 대화내역, 각 이체내역, 계좌영장 회신내역, 판매글, 연락처 『2022고단4555』 1.제3회 공판조서 중 피고인의 진술기재 1.P에 대한 각 경찰진술조서 1.각 발생보고서(절도), 입건전보사보고서(증거목록 순번 12), 각 수사보고서(증거목록 순번 14 내지 17, 20)『2022고단5103』 1.제3회 공판조서 중 피고인의 진술기재 1.T, BD, BE, BF, BG, R, BH, BI, BJ, BK, BL, BM, BN, BO, BP, BQ의 각 진술서 1.각 대화내역자료 등, 각 이체내역 등 법령의 적용 1.범죄사실에 대한 해당법조 및 형의 선택 각 형법 제347조 제1항(사기의 점), 각 형법 제347조 제1항, 제32조(사기방조의 점)각 형법 제347조의2(컴퓨터등사용사기의 점), 형법 제347조의2, 제352조(컴퓨터등사용사기미수의 점), 각 징역형 선택 1.누범가중 형법 제35조 1.방조감경 형법 제32조 제2항, 제55조 제1항 제3호 1.경합범가중 형법 제37조 전단, 제38조 제1항 제2호, 제50조 1.배상명령 및 가집행선고 소송촉진 등에 관한 특례법 제25조 제1항, 제31조 제1항, 제2항, 제3항(배상신청인 BA는 100만 원의 배상명령을 신청하였으나, 판시 범죄사실 기재 BA의 피해액 70만 원을 초과하는 부분은 그 배상책임의 존부 및 범위가 불분명하므로, 판시 범죄사실 기재 피해액인 70만 원에 관하여만 배상을 명한다)양형의 이유 피고인은 범죄사실을 인정한다."
321724,판례내용,34,"그러나 이 사건 각 범행의 구체적인 방법 및 행위 태양, 범행의 횟수, 피해자의 수, 전체 피해 가액 등을 고려할 때 피고인의 죄질이 매우 좋지 않다."
321724,판례내용,35,"피해자들 일부를 제외한 나머지 피해자들의 대부분의 피해가 여전히 회복되지 아니하였다.피고인은 사기, 컴퓨터등사용사기죄 등으로 징역형, 벌금형 등의 처벌을 받은 전력이 많고, 특히 판시 전과에 의한 누범기간 중 재차 이 사건 범행을 저질렀다."
321724,판례내용,36,피고인의 죄책이 무겁다.
321724,판례내용,37,"위와 같은 정상, 그 밖에 피고인의 나이, 성행, 환경, 범행의 동기, 수단과 결과, 범행 후의 정황 등 이 사건 기록 및 변론에 나타난 여러 양형조건을 종합하여 주문과 같이 형을 정한다."
321724,판례내용,38,판사 강○
