결정례일련번호,구분,문장번호,내용
141350,전문,1,사 건 2017헌마1022 기본권 침해 위헌확인
141350,전문,2,청 구 인 임 ○ 준
141350,전문,3,[주 문]
141350,전문,4,이 사건 심판청구를 각하한다.[이 유]
141350,전문,5,"청구인은 ○○대학교의 채플에 관한 학칙 등이 종교의 자유, 학문의 자유를 침해하고 있어 ○○대학교는 채플에 관한 학칙 등을 완화해서 학점을 주거나 채플수업의 횟수를 줄이거나 없애야 한다는 취지의 주장을 하며 2017.9.13."
141350,전문,6,"이 사건 헌법소원심판을 청구하였다.헌법재판소법 제68조 제1항에 의하여 헌법소원의 대상이 되는 행위는 국가기관의 공권력작용에 속하여야 한다.○○대학교는 학교법인 ○○대학교에 의하여 설립된 사립대학으로서 국가기관이나 공법인, 국립대학교와 같은 공법상의 영조물에 해당하지 아니하고, 일반적으로 사립대학과 그 학생과의 관계는 사법상의 계약관계이며, 사립대학이 채플과 관련한 학칙 등을 제정하는 것도 사법적 행위에 해당하므로 이를 헌법소원의 대상이 되는 공권력의 행사라고 볼 수 없다.그렇다면 이 사건 심판청구는 부적법하므로 이를 각하하기로 하여 관여 재판관 전원의 일치된 의견으로 주문과 같이 결정한다."
